#chrom,chromStart,chromEnd,name,score,strand,thickStart,thickEnd,reserved,soTerm,note,geneIds,pubMedIds,experiment,function,_mouseOver
chr1,1069211,1069326,enhancer,0,+,1069211,1069326,128128,enhancer,,106783496|GeneID:106783496,17135569|PMID:17135569,EXISTENCE:reporter gene assay evidence [ECO:0000049][PMID:17135569],enhancer in Jurkat T cells,enhancer in Jurkat T cells
chr1,3274016,3274864,enhancer,0,+,3274016,3274864,128128,enhancer,VISTA enhancer hs705,"110120751|GeneID:110120751,63976|GeneID:63976",17130149|PMID:17130149,EXISTENCE:transgenic organism evidence [ECO:0001131][PMID:17130149],enhancer in: hindbrain (rhombencephalon)[5/6],VISTA enhancer hs705 | enhancer in: hindbrain (rhombencephalon)[5/6]
chr1,3345528,3349801,enhancer,0,+,3345528,3349801,128128,enhancer,VISTA enhancer hs1912,"110121223|GeneID:110121223,63976|GeneID:63976",17130149|PMID:17130149,EXISTENCE:transgenic organism evidence [ECO:0001131][PMID:17130149],enhancer in: heart[4/4],VISTA enhancer hs1912 | enhancer in: heart[4/4]
chr1,3503968,3504669,enhancer,0,+,3503968,3504669,128128,enhancer,amplified fragment containing the chr1:3420761-3421065 (GRCh37) CAGE region,108281140|GeneID:108281140,24670763|PMID:24670763,EXISTENCE:reporter gene assay evidence [ECO:0000049][PMID:24670763],mid-level expression transcribed enhancer in HeLa cells,amplified fragment containing the chr1:3420761-3421065 (GRCh37) CAGE region | mid-level expression transcribed enhancer in HeLa cells
chr1,3504196,3504501,CAGE_cluster,0,+,3504196,3504501,"192,0,192",sequence_feature,CAGE cluster; bidirectional CAGE region,108281140|GeneID:108281140,24670763|PMID:24670763,EXISTENCE:cap analysis of gene expression evidence [ECO:0000309][PMID:24670763],,CAGE cluster; bidirectional CAGE region
chr1,5742550,5743135,DNase_I_hypersensitive_site,0,+,5742550,5743135,128128,region,region containing the chr1.1353 DHS; the nucleotide coordinates are approximate for this feature,108281186|GeneID:108281186,22955617|PMID:22955617,EXISTENCE:in vivo cleavage assay evidence [ECO:0001075][PMID:22955617],,region containing the chr1.1353 DHS; the nucleotide coordinates are approximate for this feature
chr1,5742550,5743135,enhancer,0,+,5742550,5743135,128128,enhancer,amplified fragment containing the chr1.1353 DHS,108281186|GeneID:108281186,24670763|PMID:24670763,EXISTENCE:reporter gene assay evidence [ECO:0000049][PMID:24670763],nontranscribed enhancer in HeLa cells,amplified fragment containing the chr1.1353 DHS | nontranscribed enhancer in HeLa cells
chr1,8070378,8071827,enhancer,0,+,8070378,8071827,128128,enhancer,VISTA enhancer hs1833,110121213|GeneID:110121213,17130149|PMID:17130149,EXISTENCE:transgenic organism evidence [ECO:0001131][PMID:17130149],enhancer in: neural tube[7/8] | limb[6/8] | branchial arch[6/8] | eye[4/8] | nose[6/8] | facial mesenchyme[6/8],VISTA enhancer hs1833 | enhancer in: neural tube[7/8] | limb[6/8] | branchial arch[6/8] | eye[4/8] | nose[6/8] | facial mesenchyme[6/8]
chr1,8173055,8173586,enhancer,0,+,8173055,8173586,128128,enhancer,amplified fragment containing the chr1:8233339-8233435 (GRCh37) region with regulatory potential,108281189|GeneID:108281189,24670763|PMID:24670763,EXISTENCE:reporter gene assay evidence [ECO:0000049][PMID:24670763],nontranscribed enhancer in HeLa cells,amplified fragment containing the chr1:8233339-8233435 (GRCh37) region with regulatory potential | nontranscribed enhancer in HeLa cells
chr1,8173278,8173375,epigenetically_modified_region,0,+,8173278,8173375,128128,region,co-occurring H3K27ac and H3K4me1 histone modifications and no CAGE data in HeLa cells,108281189|GeneID:108281189,22955616|PMID:22955616,EXISTENCE:chromatin immunoprecipitation-seq evidence [ECO:0000229][PMID:22955616],,co-occurring H3K27ac and H3K4me1 histone modifications and no CAGE data in HeLa cells
chr1,9371067,9372775,enhancer,0,+,9371067,9372775,128128,enhancer,VISTA enhancer hs1615,110121160|GeneID:110121160,17130149|PMID:17130149,EXISTENCE:transgenic organism evidence [ECO:0001131][PMID:17130149],enhancer in: somite[4/7] | forebrain[5/7] | branchial arch[6/7] | nose[6/7] | facial mesenchyme[6/7],VISTA enhancer hs1615 | enhancer in: somite[4/7] | forebrain[5/7] | branchial arch[6/7] | nose[6/7] | facial mesenchyme[6/7]
chr1,9627497,9627962,enhancer,0,+,9627497,9627962,128128,enhancer,,106783575|GeneID:106783575,17135569|PMID:17135569,EXISTENCE:reporter gene assay evidence [ECO:0000049][PMID:17135569],enhancer in Jurkat T cells,enhancer in Jurkat T cells
chr1,10672012,10673061,enhancer,0,+,10672012,10673061,128128,enhancer,VISTA enhancer hs289,110120648|GeneID:110120648,17130149|PMID:17130149,EXISTENCE:transgenic organism evidence [ECO:0001131][PMID:17130149],enhancer in: neural tube[5/7],VISTA enhancer hs289 | enhancer in: neural tube[5/7]
chr1,10721181,10721687,enhancer,0,+,10721181,10721687,128128,enhancer,VISTA enhancer hs389,110120666|GeneID:110120666,17130149|PMID:17130149,EXISTENCE:transgenic organism evidence [ECO:0001131][PMID:17130149],enhancer in: heart[3/8],VISTA enhancer hs389 | enhancer in: heart[3/8]
chr1,10735048,10739184,enhancer,0,+,10735048,10739184,128128,enhancer,VISTA enhancer hs2094,110121258|GeneID:110121258,17130149|PMID:17130149,EXISTENCE:transgenic organism evidence [ECO:0001131][PMID:17130149],enhancer in: hindbrain (rhombencephalon)[5/5],VISTA enhancer hs2094 | enhancer in: hindbrain (rhombencephalon)[5/5]
chr1,10791512,10792116,enhancer,0,+,10791512,10792116,128128,enhancer,VISTA enhancer hs408,110120672|GeneID:110120672,17130149|PMID:17130149,EXISTENCE:transgenic organism evidence [ECO:0001131][PMID:17130149],enhancer in: forebrain[3/4],VISTA enhancer hs408 | enhancer in: forebrain[3/4]
chr1,10905071,10906087,enhancer,0,+,10905071,10906087,128128,enhancer,VISTA enhancer hs241,110120623|GeneID:110120623,17130149|PMID:17130149,EXISTENCE:transgenic organism evidence [ECO:0001131][PMID:17130149],enhancer in: cranial nerve[5/5],VISTA enhancer hs241 | enhancer in: cranial nerve[5/5]
chr1,11885470,11889433,enhancer,0,+,11885470,11889433,128128,enhancer,VISTA enhancer hs2125,110121260|GeneID:110121260,17130149|PMID:17130149,EXISTENCE:transgenic organism evidence [ECO:0001131][PMID:17130149],enhancer in: heart[6/7],VISTA enhancer hs2125 | enhancer in: heart[6/7]
chr1,16023928,16024762,non_allelic_homologous,0,+,16023928,16024762,"160,82,45",recombination_feature,"sub-region a, recombines with sub-region a' within the CLCNKB recombination region","106501712|GeneID:106501712,1187|GeneID:1187",9326936|PMID:9326936,EXISTENCE:nucleotide sequencing assay evidence [ECO:0000219][PMID:9326936],,"sub-region a, recombines with sub-region a' within the CLCNKB recombination region"
chr1,16029800,16029964,non_allelic_homologous,0,+,16029800,16029964,"160,82,45",recombination_feature,"sub-region b, recombines with sub-region b' within the CLCNKB recombination region","106501712|GeneID:106501712,1187|GeneID:1187",10906158|PMID:10906158,EXISTENCE:nucleotide sequencing assay evidence [ECO:0000219][PMID:10906158],,"sub-region b, recombines with sub-region b' within the CLCNKB recombination region"
chr1,16034050,16036205,non_allelic_homologous,0,+,16034050,16036205,"160,82,45",recombination_feature,"sub-region c, recombines with sub-region c' within the CLCNKB recombination region",106501712|GeneID:106501712,15044642|PMID:15044642,EXISTENCE:polymerase chain reaction evidence [ECO:0000082][PMID:15044642],,"sub-region c, recombines with sub-region c' within the CLCNKB recombination region"
chr1,16044592,16045557,non_allelic_homologous,0,+,16044592,16045557,"160,82,45",recombination_feature,"sub-region a', recombines with sub-region a within the CLCNKA recombination region","106501713|GeneID:106501713,1188|GeneID:1188",9326936|PMID:9326936,EXISTENCE:nucleotide sequencing assay evidence [ECO:0000219][PMID:9326936],,"sub-region a', recombines with sub-region a within the CLCNKA recombination region"
chr1,16051375,16054065,meiotic,0,+,16051375,16054065,"160,82,45",recombination_feature,this region was identified as a recombination hotspot within the HapMap YRI population,"106501713|GeneID:106501713,1188|GeneID:1188",20981099|PMID:20981099,EXISTENCE:nucleotide sequencing assay evidence [ECO:0000219][PMID:20981099],,this region was identified as a recombination hotspot within the HapMap YRI population
chr1,16051499,16051520,nucleotide_motif,0,+,16051499,16051520,"192,0,192",sequence_feature,"nucleotide motif; similarity to the predicted 16-mer PRDM9 C-type binding motif, CCNCNNTNNNCNTNNC","106501713|GeneID:106501713,1188|GeneID:1188",,,,"nucleotide motif; similarity to the predicted 16-mer PRDM9 C-type binding motif, CCNCNNTNNNCNTNNC"
chr1,16051547,16051709,non_allelic_homologous,0,+,16051547,16051709,"160,82,45",recombination_feature,"sub-region b', recombines with sub-region b within the CLCNKA recombination region","106501713|GeneID:106501713,1188|GeneID:1188",10906158|PMID:10906158,EXISTENCE:nucleotide sequencing assay evidence [ECO:0000219][PMID:10906158],,"sub-region b', recombines with sub-region b within the CLCNKA recombination region"
chr1,16052513,16054065,meiotic,0,+,16052513,16054065,"160,82,45",recombination_feature,this region was identified as a recombination hotspot within the HapMap CEU population,"106501713|GeneID:106501713,1188|GeneID:1188",20981099|PMID:20981099,EXISTENCE:nucleotide sequencing assay evidence [ECO:0000219][PMID:20981099],,this region was identified as a recombination hotspot within the HapMap CEU population
chr1,16053402,16053415,nucleotide_motif,0,+,16053402,16053415,"192,0,192",sequence_feature,"nucleotide motif; similarity to the predicted 13-mer PRDM9 A binding motif (LD hotspot motif), CCNCCNTNNCCNC","106501713|GeneID:106501713,1188|GeneID:1188",,,,"nucleotide motif; similarity to the predicted 13-mer PRDM9 A binding motif (LD hotspot motif), CCNCCNTNNCCNC"
chr1,16057308,16059459,non_allelic_homologous,0,+,16057308,16059459,"160,82,45",recombination_feature,"sub-region c', recombines with sub-region c within the CLCNKA recombination region",106501713|GeneID:106501713,15044642|PMID:15044642,EXISTENCE:polymerase chain reaction evidence [ECO:0000082][PMID:15044642],,"sub-region c', recombines with sub-region c within the CLCNKA recombination region"
chr1,18630529,18631315,promoter,0,+,18630529,18631315,128128,promoter,BamHI/NaeI fragment spanning -403 to +373,108254694|GeneID:108254694,12234688|PMID:12234688,EXISTENCE:reporter gene assay evidence [ECO:0000049][PMID:12234688],,BamHI/NaeI fragment spanning -403 to +373
chr1,18630718,18631629,promoter,0,+,18630718,18631629,128128,promoter,-781 promoter fragment,108254694|GeneID:108254694,10839462|PMID:10839462,EXISTENCE:reporter gene assay evidence [ECO:0000049][PMID:10839462],,-781 promoter fragment
chr1,18631352,18631629,promoter,0,+,18631352,18631629,128128,promoter,-149 promoter fragment,"108254694|GeneID:108254694,5081|GeneID:5081",10839462|PMID:10839462,EXISTENCE:reporter gene assay evidence [ECO:0000049][PMID:10839462],minimal promoter in A673 cells,-149 promoter fragment | minimal promoter in A673 cells
chr1,18632168,18633682,enhancer,0,+,18632168,18633682,128128,enhancer,chr1 NRF1 and E2F4 HCT region in PAX7 intron,"108175348|GeneID:108175348,5081|GeneID:5081",20363979|PMID:20363979,EXISTENCE:transgenic organism evidence [ECO:0001131][PMID:20363979],HCT enhancer in diencephalon,chr1 NRF1 and E2F4 HCT region in PAX7 intron | HCT enhancer in diencephalon
chr1,18632176,18633790,enhancer,0,+,18632176,18633790,128128,enhancer,VISTA enhancer hs1702,"108175348|GeneID:108175348,5081|GeneID:5081",17130149|PMID:17130149,EXISTENCE:transgenic organism evidence [ECO:0001131][PMID:17130149],enhancer in: midbrain (mesencephalon)[6/8],VISTA enhancer hs1702 | enhancer in: midbrain (mesencephalon)[6/8]
chr1,18632688,18632929,conserved_region,0,+,18632688,18632929,"192,0,192",sequence_feature,conserved region; HCT with multiple NRF1 binding motifs,"108175348|GeneID:108175348,5081|GeneID:5081",20363979|PMID:20363979,EXISTENCE:sequence alignment evidence [ECO:0000200][PMID:20363979],,conserved region; HCT with multiple NRF1 binding motifs
chr1,18632856,18633060,conserved_region,0,+,18632856,18633060,"192,0,192",sequence_feature,conserved region; HCT with multiple E2F4 binding motifs,"108175348|GeneID:108175348,5081|GeneID:5081",20363979|PMID:20363979,EXISTENCE:sequence alignment evidence [ECO:0000200][PMID:20363979],,conserved region; HCT with multiple E2F4 binding motifs
chr1,25022138,25023701,enhancer,0,+,25022138,25023701,128128,enhancer,RUNX3P2E2 fragment for enhancer region 2,109851610|GeneID:109851610,26883634|PMID:26883634,EXISTENCE:reporter gene assay evidence [ECO:0000049][PMID:26883634],Epstein-Barr virus responsive enhancer,RUNX3P2E2 fragment for enhancer region 2 | Epstein-Barr virus responsive enhancer
chr1,26093361,26098252,enhancer,0,+,26093361,26098252,128128,enhancer,VISTA enhancer hs2271,110121289|GeneID:110121289,17130149|PMID:17130149,EXISTENCE:transgenic organism evidence [ECO:0001131][PMID:17130149],enhancer in: heart[3/4],VISTA enhancer hs2271 | enhancer in: heart[3/4]
chr1,26723099,26724341,enhancer,0,+,26723099,26724341,128128,enhancer,heart enhancer 10; zebrafish transgenic reporter assay,"107988049|GeneID:107988049,8289|GeneID:8289",20075146|PMID:20075146,EXISTENCE:transgenic organism evidence [ECO:0001131][PMID:20075146],enhancer in heart,heart enhancer 10; zebrafish transgenic reporter assay | enhancer in heart
chr1,26723128,26724414,enhancer,0,+,26723128,26724414,128128,enhancer,VISTA enhancer hs569; mouse transgenic reporter assay,"107988049|GeneID:107988049,8289|GeneID:8289",17130149|PMID:17130149,EXISTENCE:transgenic organism evidence [ECO:0001131][PMID:17130149],enhancer in: heart[4/9],VISTA enhancer hs569; mouse transgenic reporter assay | enhancer in: heart[4/9]
chr1,31955825,31956433,enhancer,0,+,31955825,31956433,128128,enhancer,amplified fragment containing most of the chr1:32421622-32422096 (GRCh37) CAGE region,108254669|GeneID:108254669,24670763|PMID:24670763,EXISTENCE:reporter gene assay evidence [ECO:0000049][PMID:24670763],high expression transcribed enhancer in HeLa cells,amplified fragment containing most of the chr1:32421622-32422096 (GRCh37) CAGE region | high expression transcribed enhancer in HeLa cells
chr1,31956020,31956495,CAGE_cluster,0,+,31956020,31956495,"192,0,192",sequence_feature,CAGE cluster; bidirectional CAGE region,108254669|GeneID:108254669,24670763|PMID:24670763,EXISTENCE:cap analysis of gene expression evidence [ECO:0000309][PMID:24670763],,CAGE cluster; bidirectional CAGE region
chr1,32044428,32045312,enhancer,0,+,32044428,32045312,128128,enhancer,VISTA enhancer hs645,"110120729|GeneID:110120729,10657|GeneID:10657",17130149|PMID:17130149,EXISTENCE:transgenic organism evidence [ECO:0001131][PMID:17130149],enhancer in: other[4/5],VISTA enhancer hs645 | enhancer in: other[4/5]
chr1,33363187,33365346,enhancer,0,+,33363187,33365346,128128,enhancer,VISTA enhancer hs1388,110121088|GeneID:110121088,17130149|PMID:17130149,EXISTENCE:transgenic organism evidence [ECO:0001131][PMID:17130149],enhancer in: neural tube[7/12] | midbrain (mesencephalon)[7/12] | forebrain[8/12] | other[7/12],VISTA enhancer hs1388 | enhancer in: neural tube[7/12] | midbrain (mesencephalon)[7/12] | forebrain[8/12] | other[7/12]
chr1,38094521,38095934,enhancer,0,+,38094521,38095934,128128,enhancer,VISTA enhancer hs238,"110120621|GeneID:110120621,105378653|GeneID:105378653",17130149|PMID:17130149,EXISTENCE:transgenic organism evidence [ECO:0001131][PMID:17130149],enhancer in: neural tube[13/20],VISTA enhancer hs238 | enhancer in: neural tube[13/20]
chr1,38246402,38247845,enhancer,0,+,38246402,38247845,128128,enhancer,VISTA enhancer hs1001,110120958|GeneID:110120958,17130149|PMID:17130149,EXISTENCE:transgenic organism evidence [ECO:0001131][PMID:17130149],enhancer in: neural tube[9/11] | hindbrain (rhombencephalon)[9/11] | midbrain (mesencephalon)[10/11] | forebrain[9/11],VISTA enhancer hs1001 | enhancer in: neural tube[9/11] | hindbrain (rhombencephalon)[9/11] | midbrain (mesencephalon)[10/11] | forebrain[9/11]
chr1,38262512,38266844,enhancer,0,+,38262512,38266844,128128,enhancer,VISTA enhancer hs2088,110121256|GeneID:110121256,17130149|PMID:17130149,EXISTENCE:transgenic organism evidence [ECO:0001131][PMID:17130149],enhancer in: ear[3/7],VISTA enhancer hs2088 | enhancer in: ear[3/7]
chr1,38370323,38372434,enhancer,0,+,38370323,38372434,128128,enhancer,VISTA enhancer hs1546,110121139|GeneID:110121139,17130149|PMID:17130149,EXISTENCE:transgenic organism evidence [ECO:0001131][PMID:17130149],enhancer in: forebrain[4/5],VISTA enhancer hs1546 | enhancer in: forebrain[4/5]
chr1,38726936,38728462,enhancer,0,+,38726936,38728462,128128,enhancer,VISTA enhancer hs1031,110120969|GeneID:110120969,17130149|PMID:17130149,EXISTENCE:transgenic organism evidence [ECO:0001131][PMID:17130149],enhancer in: nose[3/10],VISTA enhancer hs1031 | enhancer in: nose[3/10]
chr1,38783084,38784457,enhancer,0,+,38783084,38784457,128128,enhancer,VISTA enhancer hs1139,110121002|GeneID:110121002,17130149|PMID:17130149,EXISTENCE:transgenic organism evidence [ECO:0001131][PMID:17130149],enhancer in: hindbrain (rhombencephalon)[5/5],VISTA enhancer hs1139 | enhancer in: hindbrain (rhombencephalon)[5/5]
chr1,44034710,44037665,enhancer,0,+,44034710,44037665,128128,enhancer,VISTA enhancer hs1857,"110121214|GeneID:110121214,107984948|GeneID:107984948",17130149|PMID:17130149,EXISTENCE:transgenic organism evidence [ECO:0001131][PMID:17130149],enhancer in: midbrain (mesencephalon)[5/5],VISTA enhancer hs1857 | enhancer in: midbrain (mesencephalon)[5/5]
chr1,44249747,44250457,enhancer,0,+,44249747,44250457,128128,enhancer,VISTA enhancer hs277,110120642|GeneID:110120642,17130149|PMID:17130149,EXISTENCE:transgenic organism evidence [ECO:0001131][PMID:17130149],enhancer in: midbrain (mesencephalon)[3/4],VISTA enhancer hs277 | enhancer in: midbrain (mesencephalon)[3/4]
chr1,44524151,44525477,enhancer,0,+,44524151,44525477,128128,enhancer,VISTA enhancer hs280,"110120644|GeneID:110120644,55182|GeneID:55182",17130149|PMID:17130149,EXISTENCE:transgenic organism evidence [ECO:0001131][PMID:17130149],enhancer in: limb[4/4],VISTA enhancer hs280 | enhancer in: limb[4/4]
chr1,50110962,50111143,enhancer,0,+,50110962,50111143,128128,enhancer,heart enhancer 18,"107992392|GeneID:107992392,1996|GeneID:1996",20075146|PMID:20075146,EXISTENCE:transgenic organism evidence [ECO:0001131][PMID:20075146],enhancer in heart,heart enhancer 18 | enhancer in heart
chr1,50568873,50570617,enhancer,0,+,50568873,50570617,128128,enhancer,VISTA enhancer hs194,110120607|GeneID:110120607,17130149|PMID:17130149,EXISTENCE:transgenic organism evidence [ECO:0001131][PMID:17130149],enhancer in: midbrain (mesencephalon)[7/9],VISTA enhancer hs194 | enhancer in: midbrain (mesencephalon)[7/9]
chr1,50699522,50701114,enhancer,0,+,50699522,50701114,128128,enhancer,VISTA enhancer hs200,110120609|GeneID:110120609,17130149|PMID:17130149,EXISTENCE:transgenic organism evidence [ECO:0001131][PMID:17130149],enhancer in: forebrain[10/11] | limb[4/11],VISTA enhancer hs200 | enhancer in: forebrain[10/11] | limb[4/11]
chr1,54459372,54463153,enhancer,0,+,54459372,54463153,128128,enhancer,VISTA enhancer hs1487,110121126|GeneID:110121126,17130149|PMID:17130149,EXISTENCE:transgenic organism evidence [ECO:0001131][PMID:17130149],enhancer in: limb[8/9],VISTA enhancer hs1487 | enhancer in: limb[8/9]
chr1,55774430,55776762,enhancer,0,+,55774430,55776762,128128,enhancer,VISTA enhancer hs1622,110121161|GeneID:110121161,17130149|PMID:17130149,EXISTENCE:transgenic organism evidence [ECO:0001131][PMID:17130149],enhancer in: limb[5/6] | branchial arch[5/6] | facial mesenchyme[5/6],VISTA enhancer hs1622 | enhancer in: limb[5/6] | branchial arch[5/6] | facial mesenchyme[5/6]
chr1,59056652,59058420,enhancer,0,+,59056652,59058420,128128,enhancer,VISTA enhancer hs1485,"110121125|GeneID:110121125,101926925|GeneID:101926925",17130149|PMID:17130149,EXISTENCE:transgenic organism evidence [ECO:0001131][PMID:17130149],enhancer in: limb[3/5],VISTA enhancer hs1485 | enhancer in: limb[3/5]
chr1,61452122,61454518,enhancer,0,+,61452122,61454518,128128,enhancer,VISTA enhancer hs1309,"110121050|GeneID:110121050,4774|GeneID:4774",17130149|PMID:17130149,EXISTENCE:transgenic organism evidence [ECO:0001131][PMID:17130149],enhancer in: midbrain (mesencephalon)[7/7] | forebrain[7/7] | limb[5/7] | nose[5/7] | heart[5/7],VISTA enhancer hs1309 | enhancer in: midbrain (mesencephalon)[7/7] | forebrain[7/7] | limb[5/7] | nose[5/7] | heart[5/7]
chr1,61579787,61582487,enhancer,0,+,61579787,61582487,128128,enhancer,VISTA enhancer hs1484,110121124|GeneID:110121124,17130149|PMID:17130149,EXISTENCE:transgenic organism evidence [ECO:0001131][PMID:17130149],enhancer in: forebrain[7/8] | limb[8/8],VISTA enhancer hs1484 | enhancer in: forebrain[7/8] | limb[8/8]
chr1,61587760,61590236,enhancer,0,+,61587760,61590236,128128,enhancer,VISTA enhancer hs1450,110121108|GeneID:110121108,17130149|PMID:17130149,EXISTENCE:transgenic organism evidence [ECO:0001131][PMID:17130149],enhancer in: neural tube[8/8] | hindbrain (rhombencephalon)[8/8] | midbrain (mesencephalon)[8/8] | forebrain[8/8],VISTA enhancer hs1450 | enhancer in: neural tube[8/8] | hindbrain (rhombencephalon)[8/8] | midbrain (mesencephalon)[8/8] | forebrain[8/8]
chr1,62903677,62905223,enhancer,0,+,62903677,62905223,128128,enhancer,VISTA enhancer hs311,110120659|GeneID:110120659,17130149|PMID:17130149,EXISTENCE:transgenic organism evidence [ECO:0001131][PMID:17130149],enhancer in: neural tube[5/5],VISTA enhancer hs311 | enhancer in: neural tube[5/5]
chr1,62977862,62979213,enhancer,0,+,62977862,62979213,128128,enhancer,VISTA enhancer hs168,110120599|GeneID:110120599,17130149|PMID:17130149,EXISTENCE:transgenic organism evidence [ECO:0001131][PMID:17130149],enhancer in: dorsal root ganglion[3/4],VISTA enhancer hs168 | enhancer in: dorsal root ganglion[3/4]
chr1,62998610,63000046,enhancer,0,+,62998610,63000046,128128,enhancer,VISTA enhancer hs169,110120600|GeneID:110120600,17130149|PMID:17130149,EXISTENCE:transgenic organism evidence [ECO:0001131][PMID:17130149],enhancer in: neural tube[4/4],VISTA enhancer hs169 | enhancer in: neural tube[4/4]
chr1,63199547,63200451,enhancer,0,+,63199547,63200451,128128,enhancer,VISTA enhancer hs764,110120763|GeneID:110120763,17130149|PMID:17130149,EXISTENCE:transgenic organism evidence [ECO:0001131][PMID:17130149],enhancer in: neural tube[5/8] | hindbrain (rhombencephalon)[5/8],VISTA enhancer hs764 | enhancer in: neural tube[5/8] | hindbrain (rhombencephalon)[5/8]
chr1,79075661,79083449,enhancer,0,+,79075661,79083449,128128,enhancer,VISTA enhancer hs1989,110121238|GeneID:110121238,17130149|PMID:17130149,EXISTENCE:transgenic organism evidence [ECO:0001131][PMID:17130149],enhancer in: limb[3/3],VISTA enhancer hs1989 | enhancer in: limb[3/3]
chr1,82879682,82880588,enhancer,0,+,82879682,82880588,128128,enhancer,VISTA enhancer hs442,"110120683|GeneID:110120683,107985396|GeneID:107985396",17130149|PMID:17130149,EXISTENCE:transgenic organism evidence [ECO:0001131][PMID:17130149],enhancer in: other[3/3],VISTA enhancer hs442 | enhancer in: other[3/3]
chr1,87329508,87331054,enhancer,0,+,87329508,87331054,128128,enhancer,VISTA enhancer hs809,"110120776|GeneID:110120776,8543|GeneID:8543",17130149|PMID:17130149,EXISTENCE:transgenic organism evidence [ECO:0001131][PMID:17130149],enhancer in: branchial arch[5/14] | cranial nerve[4/14],VISTA enhancer hs809 | enhancer in: branchial arch[5/14] | cranial nerve[4/14]
chr1,87355937,87357399,enhancer,0,+,87355937,87357399,128128,enhancer,VISTA enhancer hs174,110120602|GeneID:110120602,17130149|PMID:17130149,EXISTENCE:transgenic organism evidence [ECO:0001131][PMID:17130149],enhancer in: forebrain[9/12] | limb[3/12],VISTA enhancer hs174 | enhancer in: forebrain[9/12] | limb[3/12]
chr1,87356109,87357227,enhancer,0,+,87356109,87357227,128128,enhancer,VISTA enhancer hs322,110120602|GeneID:110120602,17130149|PMID:17130149,EXISTENCE:transgenic organism evidence [ECO:0001131][PMID:17130149],enhancer in: forebrain[4/5],VISTA enhancer hs322 | enhancer in: forebrain[4/5]
chr1,87560179,87561520,enhancer,0,+,87560179,87561520,128128,enhancer,VISTA enhancer hs1161,110121010|GeneID:110121010,17130149|PMID:17130149,EXISTENCE:transgenic organism evidence [ECO:0001131][PMID:17130149],enhancer in: forebrain[6/7],VISTA enhancer hs1161 | enhancer in: forebrain[6/7]
chr1,87599357,87600847,enhancer,0,+,87599357,87600847,128128,enhancer,VISTA enhancer hs1217,110121031|GeneID:110121031,17130149|PMID:17130149,EXISTENCE:transgenic organism evidence [ECO:0001131][PMID:17130149],enhancer in: neural tube[5/8],VISTA enhancer hs1217 | enhancer in: neural tube[5/8]
chr1,87642400,87643713,enhancer,0,+,87642400,87643713,128128,enhancer,VISTA enhancer hs1002,110120959|GeneID:110120959,17130149|PMID:17130149,EXISTENCE:transgenic organism evidence [ECO:0001131][PMID:17130149],enhancer in: heart[3/5],VISTA enhancer hs1002 | enhancer in: heart[3/5]
chr1,88070035,88072707,enhancer,0,+,88070035,88072707,128128,enhancer,VISTA enhancer hs1198,110121023|GeneID:110121023,17130149|PMID:17130149,EXISTENCE:transgenic organism evidence [ECO:0001131][PMID:17130149],enhancer in: other[4/6],VISTA enhancer hs1198 | enhancer in: other[4/6]
chr1,88150003,88151244,enhancer,0,+,88150003,88151244,128128,enhancer,VISTA enhancer hs878,110120795|GeneID:110120795,17130149|PMID:17130149,EXISTENCE:transgenic organism evidence [ECO:0001131][PMID:17130149],enhancer in: limb[9/10] | tail[6/10],VISTA enhancer hs878 | enhancer in: limb[9/10] | tail[6/10]
chr1,88220392,88222057,enhancer,0,+,88220392,88222057,128128,enhancer,VISTA enhancer hs1107,110120990|GeneID:110120990,17130149|PMID:17130149,EXISTENCE:transgenic organism evidence [ECO:0001131][PMID:17130149],enhancer in: dorsal root ganglion[5/6],VISTA enhancer hs1107 | enhancer in: dorsal root ganglion[5/6]
