#chrom,chromStart,chromEnd,name,score,strand,thickStart,thickEnd,reserved,soTerm,note,geneIds,pubMedIds,experiment,function,_mouseOver
chr1,88461112,88462825,enhancer,0,+,88461112,88462825,128128,enhancer,VISTA enhancer hs327,110120664|GeneID:110120664,17130149|PMID:17130149,EXISTENCE:transgenic organism evidence [ECO:0001131][PMID:17130149],enhancer in: hindbrain (rhombencephalon)[8/10],VISTA enhancer hs327 | enhancer in: hindbrain (rhombencephalon)[8/10]
chr1,90840004,90841658,enhancer,0,+,90840004,90841658,128128,enhancer,VISTA enhancer hs612,110120716|GeneID:110120716,17130149|PMID:17130149,EXISTENCE:transgenic organism evidence [ECO:0001131][PMID:17130149],enhancer in: forebrain[5/6],VISTA enhancer hs612 | enhancer in: forebrain[5/6]
chr1,97144934,97146185,enhancer,0,+,97144934,97146185,128128,enhancer,VISTA enhancer hs671,"110120739|GeneID:110120739,100873932|GeneID:100873932",17130149|PMID:17130149,EXISTENCE:transgenic organism evidence [ECO:0001131][PMID:17130149],enhancer in: forebrain[7/7],VISTA enhancer hs671 | enhancer in: forebrain[7/7]
chr1,101922188,101924716,meiotic,0,+,101922188,101924716,"160,82,45",recombination_feature,this region was identified as a recombination hotspot within the HapMap CEU and YRI populations,107457601|GeneID:107457601,20981099|PMID:20981099,EXISTENCE:nucleotide sequencing assay evidence [ECO:0000219][PMID:20981099],,this region was identified as a recombination hotspot within the HapMap CEU and YRI populations
chr1,101923403,101925357,meiotic,0,+,101923403,101925357,"160,82,45",recombination_feature,"meiotic double-strand break mapped by DNA meiotic recombinase 1 chromatin immunoprecipitation followed by single-stranded DNA enrichment and sequencing in the germ cells of some male individuals with the PRDM9 A/A, PRDM9 A/B and PRDM9 A/C genotypes",107457601|GeneID:107457601,25395542|PMID:25395542,EXISTENCE:chromatin immunoprecipitation-seq evidence [ECO:0000229][PMID:25395542],,"meiotic double-strand break mapped by DNA meiotic recombinase 1 chromatin immunoprecipitation followed by single-stranded DNA enrichment and sequencing in the germ cells of some male individuals with the PRDM9 A/A, PRDM9 A/B and PRDM9 A/C genotypes"
chr1,101923583,101924883,meiotic,0,+,101923583,101924883,"160,82,45",recombination_feature,"crossovers mapped in sperm cells of males of European and African ancestries; recombination frequencies vary with PRDM9 genotypes, with higher recombination frequencies in individuals with PRDM9 A alleles, and little recombination in some individuals with other PRDM9 alleles",107457601|GeneID:107457601,"18650392|PMID:18650392,20818382|PMID:20818382","EXISTENCE:DNA detection assay evidence [ECO:0005519][PMID:18650392, PMID:20818382]",,"crossovers mapped in sperm cells of males of European and African ancestries; recombination frequencies vary with PRDM9 genotypes, with higher recombination frequencies in individuals with PRDM9 A alleles, and little recombination in some individuals with other PRDM9 alleles"
chr1,101924249,101924265,nucleotide_motif,0,+,101924249,101924265,"192,0,192",sequence_feature,"nucleotide motif; similarity to the predicted 16-mer PRDM9 C-type binding motif, CCNCNNTNNNCNTNNC",107457601|GeneID:107457601,,,,"nucleotide motif; similarity to the predicted 16-mer PRDM9 C-type binding motif, CCNCNNTNNNCNTNNC"
chr1,101924646,101924659,nucleotide_motif,0,+,101924646,101924659,"192,0,192",sequence_feature,"nucleotide motif; similarity, but not exact identity (7/8 nucleotides), to the predicted 13-mer PRDM9 A binding motif (LD hotspot motif), CCNCCNTNNCCNC",107457601|GeneID:107457601,"19165926|PMID:19165926,20818382|PMID:20818382","COORDINATES:motif similarity evidence [ECO:0000028][PMID:20818382, PMID:19165926]",,"nucleotide motif; similarity, but not exact identity (7/8 nucleotides), to the predicted 13-mer PRDM9 A binding motif (LD hotspot motif), CCNCCNTNNCCNC"
chr1,109253073,109256228,enhancer,0,+,109253073,109256228,128128,enhancer,VISTA enhancer hs2216,"110121283|GeneID:110121283,1952|GeneID:1952",17130149|PMID:17130149,EXISTENCE:transgenic organism evidence [ECO:0001131][PMID:17130149],"enhancer in: hindbrain (rhombencephalon)[6/10] | dorsal root ganglion[9/10] | trigeminal V (ganglion, cranial)[9/10] | cranial nerve[7/10]","VISTA enhancer hs2216 | enhancer in: hindbrain (rhombencephalon)[6/10] | dorsal root ganglion[9/10] | trigeminal V (ganglion, cranial)[9/10] | cranial nerve[7/10]"
chr1,109274251,109276283,enhancer,0,+,109274251,109276283,128128,enhancer,VISTA enhancer hs2263,110121285|GeneID:110121285,17130149|PMID:17130149,EXISTENCE:transgenic organism evidence [ECO:0001131][PMID:17130149],enhancer in: other[4/11],VISTA enhancer hs2263 | enhancer in: other[4/11]
chr1,112997433,112999398,enhancer,0,+,112997433,112999398,128128,enhancer,VISTA enhancer hs1672,110121184|GeneID:110121184,17130149|PMID:17130149,EXISTENCE:transgenic organism evidence [ECO:0001131][PMID:17130149],enhancer in: heart[7/7],VISTA enhancer hs1672 | enhancer in: heart[7/7]
chr1,116751949,116754547,promoter,0,+,116751949,116754547,128128,promoter,CM2.5 BglII to +55 full-length promoter fragment; includes DHS1 and DHS2,107161156|GeneID:107161156,"7929376|PMID:7929376,11181063|PMID:11181063","EXISTENCE:reporter gene assay evidence [ECO:0000049][PMID:7929376, PMID:11181063]",CD2 T cell-specific gene expression,CM2.5 BglII to +55 full-length promoter fragment; includes DHS1 and DHS2 | CD2 T cell-specific gene expression
chr1,116752179,116752679,transcriptional_cis_regulatory_region,0,+,116752179,116752679,128128,region,0.5 kb activator PCR fragment,107161156|GeneID:107161156,11181063|PMID:11181063,EXISTENCE:reporter gene assay evidence [ECO:0000049][PMID:11181063],CD2 transcriptional activation,0.5 kb activator PCR fragment | CD2 transcriptional activation
chr1,116752179,116753183,DNase_I_hypersensitive_site,0,+,116752179,116753183,128128,region,DHS1; 1 kb PCR fragment from PMID:11181063; includes activator and silencer regions; the nucleotide coordinates are approximate for this feature,107161156|GeneID:107161156,"2567000|PMID:2567000,11181063|PMID:11181063",EXISTENCE:in vivo cleavage assay evidence [ECO:0001075][PMID:2567000],,DHS1; 1 kb PCR fragment from PMID:11181063; includes activator and silencer regions; the nucleotide coordinates are approximate for this feature
chr1,116752679,116753183,silencer,0,+,116752679,116753183,128128,silencer,0.5 kb silencer PCR fragment,107161156|GeneID:107161156,11181063|PMID:11181063,EXISTENCE:reporter gene assay evidence [ECO:0000049][PMID:11181063],CD2 transcriptional repression,0.5 kb silencer PCR fragment | CD2 transcriptional repression
chr1,116753016,116753046,transcriptional_cis_regulatory_region,0,+,116753016,116753046,128128,region,AP2-binding site probe; binds an unidentified factor but not AP2,107161156|GeneID:107161156,11181063|PMID:11181063,EXISTENCE:reporter gene assay evidence [ECO:0000049][PMID:11181063],required for repressor activity,AP2-binding site probe; binds an unidentified factor but not AP2 | required for repressor activity
chr1,116754104,116754547,promoter,0,+,116754104,116754547,128128,promoter,CM0.5 AccI to +55 minimal promoter fragment; includes DHS2 only,107161156|GeneID:107161156,"7929376|PMID:7929376,11181063|PMID:11181063","EXISTENCE:reporter gene assay evidence [ECO:0000049][PMID:7929376, PMID:11181063]",CD2 T cell-specific gene expression,CM0.5 AccI to +55 minimal promoter fragment; includes DHS2 only | CD2 T cell-specific gene expression
chr1,116754124,116754524,DNase_I_hypersensitive_site,0,+,116754124,116754524,128128,region,DHS2; the nucleotide coordinates are approximate for this feature,107161156|GeneID:107161156,2567000|PMID:2567000,EXISTENCE:in vivo cleavage assay evidence [ECO:0001075][PMID:2567000],,DHS2; the nucleotide coordinates are approximate for this feature
chr1,116754383,116754413,protein_bind: upstream transcription factor protein(s),0,+,116754383,116754413,"192,0,0",protein_binding_site,USF-binding E box motif,107161156|GeneID:107161156,7929376|PMID:7929376,EXISTENCE:protein binding evidence [ECO:0000024][PMID:7929376],required for CD2 basal transcriptional activity,USF-binding E box motif | required for CD2 basal transcriptional activity | upstream transcription factor protein(s)
chr1,116769216,116770316,enhancer,0,+,116769216,116770316,128128,enhancer,1.1 kb exonuclease III-digested HindIII fragment with partial/complete exclusion of HSS2 and HSS3; 3' coordinate approximate,107126361|GeneID:107126361,1682894|PMID:1682894,EXISTENCE:transgenic organism evidence [ECO:0001131][PMID:1682894],CD2 enhancer that lacks copy number-dependent and position-indpendent function in transgenes,1.1 kb exonuclease III-digested HindIII fragment with partial/complete exclusion of HSS2 and HSS3; 3' coordinate approximate | CD2 enhancer that lacks copy number-dependent and position-indpendent function in transgenes
chr1,116769216,116770516,enhancer,0,+,116769216,116770516,128128,enhancer,1.3 kb exonuclease III-digested HindIII fragment with exclusion of HSS3; 3' coordinate approximate,107126361|GeneID:107126361,"8599090|PMID:8599090,10581035|PMID:10581035","EXISTENCE:transgenic organism evidence [ECO:0001131][PMID:8599090, PMID:10581035]",CD2 enhancer that confers mosaic expression in transgenes,1.3 kb exonuclease III-digested HindIII fragment with exclusion of HSS3; 3' coordinate approximate | CD2 enhancer that confers mosaic expression in transgenes
chr1,116769216,116770716,enhancer,0,+,116769216,116770716,128128,enhancer,1.5 kb exonuclease III-digested HindIII fragment with partial exclusion of HSS3; 3' coordinate approximate,107126361|GeneID:107126361,"1682894|PMID:1682894,8599090|PMID:8599090","EXISTENCE:transgenic organism evidence [ECO:0001131][PMID:1682894, PMID:8599090]",CD2 enhancer that confers copy number-dependent but mosaic expression in transgenes,1.5 kb exonuclease III-digested HindIII fragment with partial exclusion of HSS3; 3' coordinate approximate | CD2 enhancer that confers copy number-dependent but mosaic expression in transgenes
chr1,116769216,116771338,locus_control_region,0,+,116769216,116771338,128128,locus_control_region,2.1 kb HindIII fragment,107126361|GeneID:107126361,"1682894|PMID:1682894,8599090|PMID:8599090","EXISTENCE:transgenic organism evidence [ECO:0001131][PMID:1682894, PMID:8599090]",lymphocyte-specific developmental regulation of the CD2 gene,2.1 kb HindIII fragment | lymphocyte-specific developmental regulation of the CD2 gene
chr1,116769253,116774826,locus_control_region,0,+,116769253,116774826,128128,locus_control_region,5.5 kb BamHI-XbaI fragment,107126361|GeneID:107126361,"2564317|PMID:2564317,7665895|PMID:7665895","EXISTENCE:transgenic organism evidence [ECO:0001131][PMID:2564317, PMID:7665895]",lymphocyte-specific developmental regulation of the CD2 gene,5.5 kb BamHI-XbaI fragment | lymphocyte-specific developmental regulation of the CD2 gene
chr1,116769616,116770216,DNase_I_hypersensitive_site,0,+,116769616,116770216,128128,region,HSS1; the nucleotide coordinates are approximate for this feature,107126361|GeneID:107126361,8599090|PMID:8599090,EXISTENCE:in vivo cleavage assay evidence [ECO:0001075][PMID:8599090],LCR enhancer region,HSS1; the nucleotide coordinates are approximate for this feature | LCR enhancer region
chr1,116769648,116770178,enhancer,0,+,116769648,116770178,128128,enhancer,550 bp AflII-MstII fragment,107126361|GeneID:107126361,2209539|PMID:2209539,EXISTENCE:reporter gene assay evidence [ECO:0000049][PMID:2209539],minimal CD2 enhancer,550 bp AflII-MstII fragment | minimal CD2 enhancer
chr1,116769663,116769684,transcriptional_cis_regulatory_region,0,+,116769663,116769684,128128,region,CD2E1 sequence,107126361|GeneID:107126361,7706298|PMID:7706298,EXISTENCE:reporter gene assay evidence [ECO:0000049][PMID:7706298],necessary for full enhancer activity,CD2E1 sequence | necessary for full enhancer activity
chr1,116769751,116769775,protein_bind: SRY-box 4,0,+,116769751,116769775,"192,0,0",protein_binding_site,CD2E2 SOX4-binding site,107126361|GeneID:107126361,7706298|PMID:7706298,EXISTENCE:protein binding evidence [ECO:0000024][PMID:7706298],reporter gene transactivation,CD2E2 SOX4-binding site | reporter gene transactivation | SRY-box 4
chr1,116769751,116769775,transcriptional_cis_regulatory_region,0,+,116769751,116769775,128128,region,CD2E2 sequence,107126361|GeneID:107126361,7706298|PMID:7706298,EXISTENCE:reporter gene assay evidence [ECO:0000049][PMID:7706298],necessary for full enhancer activity,CD2E2 sequence | necessary for full enhancer activity
chr1,116769849,116769872,transcriptional_cis_regulatory_region,0,+,116769849,116769872,128128,region,CD2E3 sequence,107126361|GeneID:107126361,7706298|PMID:7706298,EXISTENCE:reporter gene assay evidence [ECO:0000049][PMID:7706298],necessary for full enhancer activity,CD2E3 sequence | necessary for full enhancer activity
chr1,116769946,116769978,protein_bind: E74-like factor 1 (ets domain transcription factor),0,+,116769946,116769978,"192,0,0",protein_binding_site,CD2E4 Elf1-binding site; cannot confer transcriptional inducibility on a reporter gene,107126361|GeneID:107126361,7706298|PMID:7706298,EXISTENCE:protein binding evidence [ECO:0000024][PMID:7706298],,CD2E4 Elf1-binding site; cannot confer transcriptional inducibility on a reporter gene | E74-like factor 1 (ets domain transcription factor)
chr1,116769946,116769978,transcriptional_cis_regulatory_region,0,+,116769946,116769978,128128,region,CD2E4 sequence,107126361|GeneID:107126361,7706298|PMID:7706298,EXISTENCE:reporter gene assay evidence [ECO:0000049][PMID:7706298],necessary for full enhancer activity,CD2E4 sequence | necessary for full enhancer activity
chr1,116770216,116770566,DNase_I_hypersensitive_site,0,+,116770216,116770566,128128,region,HSS2; the nucleotide coordinates are approximate for this feature,107126361|GeneID:107126361,8599090|PMID:8599090,EXISTENCE:in vivo cleavage assay evidence [ECO:0001075][PMID:8599090],,HSS2; the nucleotide coordinates are approximate for this feature
chr1,116770616,116771016,DNase_I_hypersensitive_site,0,+,116770616,116771016,128128,region,HSS3; the nucleotide coordinates are approximate for this feature,107126361|GeneID:107126361,8599090|PMID:8599090,EXISTENCE:in vivo cleavage assay evidence [ECO:0001075][PMID:8599090],required for prevention of position effect variegation,HSS3; the nucleotide coordinates are approximate for this feature | required for prevention of position effect variegation
chr1,116770644,116770656,protein_bind: HMG-box transcription factor 1,0,+,116770644,116770656,"192,0,0",protein_binding_site,HBP1-binding site,107126361|GeneID:107126361,10562551|PMID:10562551,EXISTENCE:protein binding evidence [ECO:0000024][PMID:10562551],necessary to protect transgenes integrated in heterochromatic regions from position effect variegation,HBP1-binding site | necessary to protect transgenes integrated in heterochromatic regions from position effect variegation | HMG-box transcription factor 1
chr1,118485402,118487332,enhancer,0,+,118485402,118487332,128128,enhancer,VISTA enhancer hs1428,110121098|GeneID:110121098,17130149|PMID:17130149,EXISTENCE:transgenic organism evidence [ECO:0001131][PMID:17130149],enhancer in: somite[5/9] | limb[9/9],VISTA enhancer hs1428 | enhancer in: somite[5/9] | limb[9/9]
chr1,119414076,119415203,promoter,0,+,119414076,119415203,128128,promoter,-1073 to +53 promoter fragment,109029530|GeneID:109029530,15928316|PMID:15928316,EXISTENCE:reporter gene assay evidence [ECO:0000049][PMID:15928316],,-1073 to +53 promoter fragment
chr1,119414246,119414266,protein_bind: nuclear receptor subfamily 5 group A member 2,0,+,119414246,119414266,"192,0,0",protein_binding_site,FP1 site,109029530|GeneID:109029530,14671206|PMID:14671206,EXISTENCE:protein binding evidence [ECO:0000024][PMID:14671206],positive regulation of promoter activity,FP1 site | positive regulation of promoter activity | nuclear receptor subfamily 5 group A member 2
chr1,119414626,119415344,promoter,0,+,119414626,119415344,128128,promoter,-583 to +193 promoter fragment,109029530|GeneID:109029530,15291746|PMID:15291746,EXISTENCE:reporter gene assay evidence [ECO:0000049][PMID:15291746],,-583 to +193 promoter fragment
chr1,119414820,119414840,protein_bind: nuclear receptor subfamily 5 group A member 2,0,+,119414820,119414840,"192,0,0",protein_binding_site,FP2 site,109029530|GeneID:109029530,14671206|PMID:14671206,EXISTENCE:protein binding evidence [ECO:0000024][PMID:14671206],important for promoter activity,FP2 site | important for promoter activity | nuclear receptor subfamily 5 group A member 2
chr1,119414944,119414962,protein_bind: GATA binding protein 4,0,+,119414944,119414962,"192,0,0",protein_binding_site,-196 GATA site,"109029530|GeneID:109029530,3284|GeneID:3284",15928316|PMID:15928316,EXISTENCE:protein binding evidence [ECO:0000024][PMID:15928316],positive regulation of promoter activity,-196 GATA site | positive regulation of promoter activity | GATA binding protein 4
chr1,119415011,119415025,protein_bind: nuclear receptor subfamily 1 group H member 4,0,+,119415011,119415025,"192,0,0",protein_binding_site,FXRE,"109029530|GeneID:109029530,3284|GeneID:3284",19059462|PMID:19059462,EXISTENCE:protein binding evidence [ECO:0000024][PMID:19059462],positive regulation of promoter activity,FXRE | positive regulation of promoter activity | nuclear receptor subfamily 1 group H member 4
chr1,119415011,119415031,protein_bind: nuclear receptor subfamily 4 group A member 1,0,+,119415011,119415031,"192,0,0",protein_binding_site,NBRE,"109029530|GeneID:109029530,3284|GeneID:3284",15498889|PMID:15498889,EXISTENCE:protein binding evidence [ECO:0000024][PMID:15498889],mediates induction of transcription by cyclic AMP,NBRE | mediates induction of transcription by cyclic AMP | nuclear receptor subfamily 4 group A member 1
chr1,119415021,119415051,protein_bind: signal transducer and activator of transcription 5,0,+,119415021,119415051,"192,0,0",protein_binding_site,Stat5 probe,"109029530|GeneID:109029530,3284|GeneID:3284",10406460|PMID:10406460,EXISTENCE:protein binding evidence [ECO:0000024][PMID:10406460],positive regulation of promoter activity,Stat5 probe | positive regulation of promoter activity | signal transducer and activator of transcription 5
chr1,119415080,119415099,protein_bind: nuclear receptor subfamily 5 group A members 1 and 2,0,+,119415080,119415099,"192,0,0",protein_binding_site,SF-1/Ad4BP site; -60 element,"109029530|GeneID:109029530,3284|GeneID:3284","9065466|PMID:9065466,15498889|PMID:15498889","EXISTENCE:protein binding evidence [ECO:0000024][PMID:9065466, PMID:15498889]",,SF-1/Ad4BP site; -60 element | nuclear receptor subfamily 5 group A members 1 and 2
chr1,119415257,119415293,protein_bind: YY1 transcription factor,0,+,119415257,119415293,"192,0,0",protein_binding_site,3beta2S probe,"109029530|GeneID:109029530,3284|GeneID:3284",15291746|PMID:15291746,EXISTENCE:protein binding evidence [ECO:0000024][PMID:15291746],,3beta2S probe | YY1 transcription factor
chr1,119415296,119415325,protein_bind: YY1 transcription factor,0,+,119415296,119415325,"192,0,0",protein_binding_site,+147 to +175 site,"109029530|GeneID:109029530,3284|GeneID:3284",15291746|PMID:15291746,EXISTENCE:protein binding evidence [ECO:0000024][PMID:15291746],,+147 to +175 site | YY1 transcription factor
chr1,119504328,119507391,promoter,0,+,119504328,119507391,128128,promoter,-2880 to +182 promoter,109029529|GeneID:109029529,15131259|PMID:15131259,EXISTENCE:reporter gene assay evidence [ECO:0000049][PMID:15131259],,-2880 to +182 promoter
chr1,119504620,119504692,enhancer,0,+,119504620,119504692,128128,enhancer,HSD-En; -2670 to -2518 placental enhancer,109029529|GeneID:109029529,15131259|PMID:15131259,EXISTENCE:reporter gene assay evidence [ECO:0000049][PMID:15131259],enhancer in JEG-3 placental cells,HSD-En; -2670 to -2518 placental enhancer | enhancer in JEG-3 placental cells
chr1,119504642,119504662,protein_bind: GATA binding protein 4,0,+,119504642,119504662,"192,0,0",protein_binding_site,HSD-En,109029529|GeneID:109029529,15131259|PMID:15131259,EXISTENCE:protein binding evidence [ECO:0000024][PMID:15131259],,HSD-En | GATA binding protein 4
chr1,119504642,119504662,protein_bind: TEA domain transcription factor 3,0,+,119504642,119504662,"192,0,0",protein_binding_site,HSD-En,109029529|GeneID:109029529,15131259|PMID:15131259,EXISTENCE:protein binding evidence [ECO:0000024][PMID:15131259],,HSD-En | TEA domain transcription factor 3
chr1,119506351,119506377,protein_bind: signal transducer and activator of transcription 6,0,+,119506351,119506377,"192,0,0",protein_binding_site,Stat6 #1 site,109029529|GeneID:109029529,9892013|PMID:9892013,EXISTENCE:protein binding evidence [ECO:0000024][PMID:9892013],,Stat6 #1 site | signal transducer and activator of transcription 6
chr1,119506717,119507391,promoter,0,+,119506717,119507391,128128,promoter,-492 to +182 promoter,109029529|GeneID:109029529,8584035|PMID:8584035,EXISTENCE:reporter gene assay evidence [ECO:0000049][PMID:8584035],,-492 to +182 promoter
chr1,119507042,119507068,protein_bind: signal transducer and activator of transcription 6,0,+,119507042,119507068,"192,0,0",protein_binding_site,Stat6 #2 site,109029529|GeneID:109029529,9892013|PMID:9892013,EXISTENCE:protein binding evidence [ECO:0000024][PMID:9892013],,Stat6 #2 site | signal transducer and activator of transcription 6
chr1,119507072,119507093,protein_bind: nuclear receptor subfamily 4 group A members 1 and 2,0,+,119507072,119507093,"192,0,0",protein_binding_site,NBRE,109029529|GeneID:109029529,25092869|PMID:25092869,EXISTENCE:protein binding evidence [ECO:0000024][PMID:25092869],,NBRE | nuclear receptor subfamily 4 group A members 1 and 2
chr1,119507313,119507337,enhancer,0,+,119507313,119507337,128128,enhancer,3betaI-A element,"109029529|GeneID:109029529,3283|GeneID:3283",8584035|PMID:8584035,EXISTENCE:reporter gene assay evidence [ECO:0000049][PMID:8584035],,3betaI-A element
chr1,119507313,119507337,protein_bind: Sp1 transcription factor,0,+,119507313,119507337,"192,0,0",protein_binding_site,3betaI-A element,"109029529|GeneID:109029529,3283|GeneID:3283",8584035|PMID:8584035,EXISTENCE:protein binding evidence [ECO:0000024][PMID:8584035],,3betaI-A element | Sp1 transcription factor
chr1,119507313,119507337,protein_bind: YY1 transcription factor,0,+,119507313,119507337,"192,0,0",protein_binding_site,3betaI-A element,"109029529|GeneID:109029529,3283|GeneID:3283",15291746|PMID:15291746,EXISTENCE:protein binding evidence [ECO:0000024][PMID:15291746],,3betaI-A element | YY1 transcription factor
chr1,119507334,119507357,protein_bind: YY1 transcription factor,0,+,119507334,119507357,"192,0,0",protein_binding_site,+126 to +151 site,"109029529|GeneID:109029529,3283|GeneID:3283",15291746|PMID:15291746,EXISTENCE:protein binding evidence [ECO:0000024][PMID:15291746],,+126 to +151 site | YY1 transcription factor
chr1,145960449,145960568,enhancer,0,+,145960449,145960568,128128,enhancer,,"106783502|GeneID:106783502,84265|GeneID:84265",17135569|PMID:17135569,EXISTENCE:reporter gene assay evidence [ECO:0000049][PMID:17135569],enhancer in Jurkat T cells,enhancer in Jurkat T cells
chr1,145979292,145979934,enhancer,0,+,145979292,145979934,128128,enhancer,amplified fragment containing most of the chr1:145455122-145455741 (GRCh37) CAGE region,108254679|GeneID:108254679,24670763|PMID:24670763,EXISTENCE:reporter gene assay evidence [ECO:0000049][PMID:24670763],low expression transcribed enhancer in HeLa and HepG2 cells,amplified fragment containing most of the chr1:145455122-145455741 (GRCh37) CAGE region | low expression transcribed enhancer in HeLa and HepG2 cells
chr1,145979342,145979962,CAGE_cluster,0,+,145979342,145979962,"192,0,192",sequence_feature,CAGE cluster; bidirectional CAGE region,108254679|GeneID:108254679,24670763|PMID:24670763,EXISTENCE:cap analysis of gene expression evidence [ECO:0000309][PMID:24670763],,CAGE cluster; bidirectional CAGE region
chr1,147748577,147753770,enhancer,0,+,147748577,147753770,128128,enhancer,VISTA enhancer hs2126,"110121261|GeneID:110121261,102723321|GeneID:102723321",17130149|PMID:17130149,EXISTENCE:transgenic organism evidence [ECO:0001131][PMID:17130149],enhancer in: heart[5/6],VISTA enhancer hs2126 | enhancer in: heart[5/6]
chr1,152049545,152050038,CAGE_cluster,0,+,152049545,152050038,"192,0,192",sequence_feature,CAGE cluster; bidirectional CAGE region,108254671|GeneID:108254671,24670763|PMID:24670763,EXISTENCE:cap analysis of gene expression evidence [ECO:0000309][PMID:24670763],,CAGE cluster; bidirectional CAGE region
chr1,152049599,152050161,enhancer,0,+,152049599,152050161,128128,enhancer,amplified fragment containing most of the chr1:152022022-152022514 (GRCh37) CAGE region,108254671|GeneID:108254671,24670763|PMID:24670763,EXISTENCE:reporter gene assay evidence [ECO:0000049][PMID:24670763],high expression transcribed enhancer in HeLa cells,amplified fragment containing most of the chr1:152022022-152022514 (GRCh37) CAGE region | high expression transcribed enhancer in HeLa cells
chr1,152906046,152909786,promoter,0,+,152906046,152909786,128128,promoter,-2500 to +1240; full proximal regulatory region,107880064|GeneID:107880064,8234288|PMID:8234288,EXISTENCE:transgenic organism evidence [ECO:0001131][PMID:8234288],drive expression in epitheium of keratinocytes,-2500 to +1240; full proximal regulatory region | drive expression in epitheium of keratinocytes
chr1,152906071,152906457,enhancer,0,+,152906071,152906457,128128,enhancer,-2473 to -2088; distal regulatory region (DRR),107880064|GeneID:107880064,9512462|PMID:9512462,EXISTENCE:reporter gene assay evidence [ECO:0000049][PMID:9512462],"drives expression in upper granular layers of epidermis, esophagus and cervix","-2473 to -2088; distal regulatory region (DRR) | drives expression in upper granular layers of epidermis, esophagus and cervix"
