#chrom,chromStart,chromEnd,name,score,strand,thickStart,thickEnd,reserved,soTerm,note,geneIds,pubMedIds,experiment,function,_mouseOver
chr1,152906071,152906595,enhancer,0,+,152906071,152906595,128128,enhancer,HindIII/HaeII fragment,107880064|GeneID:107880064,9804813|PMID:9804813,EXISTENCE:transgenic organism evidence [ECO:0001131][PMID:9804813],drives expression in epidermis,HindIII/HaeII fragment | drives expression in epidermis
chr1,152906071,152907313,enhancer,0,+,152906071,152907313,128128,enhancer,HindIII/RsaI fragment,107880064|GeneID:107880064,8550612|PMID:8550612,EXISTENCE:reporter gene assay evidence [ECO:0000049][PMID:8550612],stimulates expression in response to calcium,HindIII/RsaI fragment | stimulates expression in response to calcium
chr1,152906405,152906457,enhancer,0,+,152906405,152906457,128128,enhancer,-2140 to -2088,107880064|GeneID:107880064,9895295|PMID:9895295,EXISTENCE:reporter gene assay evidence [ECO:0000049][PMID:9895295],promotes expression upon binding by Sp1,-2140 to -2088 | promotes expression upon binding by Sp1
chr1,152906409,152906513,response_element,0,+,152906409,152906513,128128,regulatory_region,-2131 to -2028,107880064|GeneID:107880064,9159190|PMID:9159190,EXISTENCE:reporter gene assay evidence [ECO:0000049][PMID:9159190],mediates induction by calcium,-2131 to -2028 | mediates induction by calcium
chr1,152906410,152906450,"protein_bind: JunB proto-oncogene, AP-1 transcription factor subunit",0,+,152906410,152906450,"192,0,0",protein_binding_site,AP1-5,107880064|GeneID:107880064,7759510|PMID:7759510,EXISTENCE:protein binding evidence [ECO:0000024][PMID:7759510],mediates response to phorbol ester,"AP1-5 | mediates response to phorbol ester | JunB proto-oncogene, AP-1 transcription factor subunit"
chr1,152906417,152906437,"protein_bind: FOS like 1, AP-1 trancription factor subunit",0,+,152906417,152906437,"192,0,0",protein_binding_site,AP1-5,107880064|GeneID:107880064,"7759510|PMID:7759510,10816578|PMID:10816578,11254751|PMID:11254751","EXISTENCE:protein binding evidence [ECO:0000024][PMID:7759510, PMID:10816578, PMID:11254751]","mediates response to phorbol ester, oxysterol, calcium, and cholesterol sulfate","AP1-5 | mediates response to phorbol ester, oxysterol, calcium, and cholesterol sulfate | FOS like 1, AP-1 trancription factor subunit"
chr1,152906417,152906437,"protein_bind: FOS like 2, AP-1 trancription factor subunit",0,+,152906417,152906437,"192,0,0",protein_binding_site,AP1-5,107880064|GeneID:107880064,"7759510|PMID:7759510,10816578|PMID:10816578,11254751|PMID:11254751","EXISTENCE:protein binding evidence [ECO:0000024][PMID:7759510, PMID:10816578, PMID:11254751]","mediates response to phorbol ester, oxysterol, calcium, and cholesterol sulfate","AP1-5 | mediates response to phorbol ester, oxysterol, calcium, and cholesterol sulfate | FOS like 2, AP-1 trancription factor subunit"
chr1,152906417,152906437,"protein_bind: FosB proto-oncogene, AP-1 trancription factor subunit",0,+,152906417,152906437,"192,0,0",protein_binding_site,AP1-5,107880064|GeneID:107880064,15025563|PMID:15025563,EXISTENCE:protein binding evidence [ECO:0000024][PMID:15025563],,"AP1-5 | FosB proto-oncogene, AP-1 trancription factor subunit"
chr1,152906417,152906437,"protein_bind: JunD proto-oncogene, AP-1 transcription factor subunit",0,+,152906417,152906437,"192,0,0",protein_binding_site,AP1-5,107880064|GeneID:107880064,"7759510|PMID:7759510,10816578|PMID:10816578,11254751|PMID:11254751","EXISTENCE:protein binding evidence [ECO:0000024][PMID:7759510, PMID:10816578, PMID:11254751]","mediates response to phorbol ester, oxysterol, calcium, and cholesterol sulfate","AP1-5 | mediates response to phorbol ester, oxysterol, calcium, and cholesterol sulfate | JunD proto-oncogene, AP-1 transcription factor subunit"
chr1,152906422,152906442,protein_bind: Sp1 transcription factor,0,+,152906422,152906442,"192,0,0",protein_binding_site,Sp1 site,107880064|GeneID:107880064,"9512462|PMID:9512462,16123409|PMID:16123409","EXISTENCE:protein binding evidence [ECO:0000024][PMID:9512462, PMID:16123409]",synergizes with adjacent AP-1 site to promote activity of enhancer,Sp1 site | synergizes with adjacent AP-1 site to promote activity of enhancer | Sp1 transcription factor
chr1,152906422,152906442,protein_bind: Sp3 transcription factor,0,+,152906422,152906442,"192,0,0",protein_binding_site,Sp1 site,107880064|GeneID:107880064,16123409|PMID:16123409,EXISTENCE:protein binding evidence [ECO:0000024][PMID:16123409],,Sp1 site | Sp3 transcription factor
chr1,152906435,152906462,response_element,0,+,152906435,152906462,128128,regulatory_region,VDRE (vitamin D response element),107880064|GeneID:107880064,12445200|PMID:12445200,EXISTENCE:reporter gene assay evidence [ECO:0000049][PMID:12445200],mediates response to vitamin D,VDRE (vitamin D response element) | mediates response to vitamin D
chr1,152906745,152907228,enhancer,0,+,152906745,152907228,128128,enhancer,PstI/AluI fragment,107880064|GeneID:107880064,8798509|PMID:8798509,EXISTENCE:reporter gene assay evidence [ECO:0000049][PMID:8798509],promotes differentiation,PstI/AluI fragment | promotes differentiation
chr1,152906852,152906877,protein_bind: transcription factor AP-2 gamma,0,+,152906852,152906877,"192,0,0",protein_binding_site,-1691 to -1667 probe,107880064|GeneID:107880064,12192491|PMID:12192491,EXISTENCE:protein binding evidence [ECO:0000024][PMID:12192491],,-1691 to -1667 probe | transcription factor AP-2 gamma
chr1,152907646,152908586,promoter,0,+,152907646,152908586,128128,promoter,-900 to +40,107880064|GeneID:107880064,1487505|PMID:1487505,EXISTENCE:reporter gene assay evidence [ECO:0000049][PMID:1487505],,-900 to +40
chr1,152907663,152907673,protein_bind: signal transducer and activator of transcription 1,0,+,152907663,152907673,"192,0,0",protein_binding_site,G1 (-883 to -874),107880064|GeneID:107880064,10585866|PMID:10585866,EXISTENCE:protein binding evidence [ECO:0000024][PMID:10585866],mediates activation by interferon gamma,G1 (-883 to -874) | mediates activation by interferon gamma | signal transducer and activator of transcription 1
chr1,152907895,152908392,transcriptional_cis_regulatory_region,0,+,152907895,152908392,128128,region,PstI/AvaI fragment; negative regulation of gene expression,107880064|GeneID:107880064,8550612|PMID:8550612,EXISTENCE:reporter gene assay evidence [ECO:0000049][PMID:8550612],,PstI/AvaI fragment; negative regulation of gene expression
chr1,152907996,152908013,protein_bind: TEA domain transcription factor 1,0,+,152907996,152908013,"192,0,0",protein_binding_site,T1,107880064|GeneID:107880064,8554386|PMID:8554386,EXISTENCE:protein binding evidence [ECO:0000024][PMID:8554386],negative regulation of transcription,T1 | negative regulation of transcription | TEA domain transcription factor 1
chr1,152908013,152908029,protein_bind: TEA domain transcription factor 1,0,+,152908013,152908029,"192,0,0",protein_binding_site,T2,107880064|GeneID:107880064,8554386|PMID:8554386,EXISTENCE:protein binding evidence [ECO:0000024][PMID:8554386],negative regulation of transcription,T2 | negative regulation of transcription | TEA domain transcription factor 1
chr1,152908068,152908092,protein_bind: PC4 and SFRS1 interacting protein 1,0,+,152908068,152908092,"192,0,0",protein_binding_site,-454 to -477 probe,107880064|GeneID:107880064,12126624|PMID:12126624,EXISTENCE:protein binding evidence [ECO:0000024][PMID:12126624],promotes gene expression in HCK cells,-454 to -477 probe | promotes gene expression in HCK cells | PC4 and SFRS1 interacting protein 1
chr1,152908116,152908136,protein_bind: TEA domain transcription factor 1,0,+,152908116,152908136,"192,0,0",protein_binding_site,T3,107880064|GeneID:107880064,8554386|PMID:8554386,EXISTENCE:protein binding evidence [ECO:0000024][PMID:8554386],,T3 | TEA domain transcription factor 1
chr1,152908160,152908213,silencer,0,+,152908160,152908213,128128,silencer,-386 to -335,107880064|GeneID:107880064,15120610|PMID:15120610,EXISTENCE:reporter gene assay evidence [ECO:0000049][PMID:15120610],,-386 to -335
chr1,152908173,152908213,protein_bind: POU class 2 homeobox 2,0,+,152908173,152908213,"192,0,0",protein_binding_site,OL40,107880064|GeneID:107880064,15120610|PMID:15120610,EXISTENCE:protein binding evidence [ECO:0000024][PMID:15120610],suppresses gene expression,OL40 | suppresses gene expression | POU class 2 homeobox 2
chr1,152908279,152908312,"protein_bind: Jun proto-oncogene, AP-1 transcription factor subunit",0,+,152908279,152908312,"192,0,0",protein_binding_site,H2 footprint,107880064|GeneID:107880064,8550612|PMID:8550612,EXISTENCE:protein binding evidence [ECO:0000024][PMID:8550612],,"H2 footprint | Jun proto-oncogene, AP-1 transcription factor subunit"
chr1,152908305,152908540,promoter,0,+,152908305,152908540,128128,promoter,-241 to -7; proximal promoter region (PRR),107880064|GeneID:107880064,7759510|PMID:7759510,EXISTENCE:reporter gene assay evidence [ECO:0000049][PMID:7759510],,-241 to -7; proximal promoter region (PRR)
chr1,152908397,152908419,protein_bind: CCAAT/enhancer binding protein alpha,0,+,152908397,152908419,"192,0,0",protein_binding_site,C/EBP site,107880064|GeneID:107880064,"10037704|PMID:10037704,10970794|PMID:10970794,15044435|PMID:15044435","EXISTENCE:protein binding evidence [ECO:0000024][PMID:10037704, PMID:10970794, PMID:15044435]","mediates response to phorbol ester, thapsigargin, green tea polyphenol, curcumin","C/EBP site | mediates response to phorbol ester, thapsigargin, green tea polyphenol, curcumin | CCAAT/enhancer binding protein alpha"
chr1,152908415,152908436,"protein_bind: FOS like 2, AP-1 trancription factor subunit",0,+,152908415,152908436,"192,0,0",protein_binding_site,AP1-1,107880064|GeneID:107880064,15037572|PMID:15037572,EXISTENCE:protein binding evidence [ECO:0000024][PMID:15037572],mediates response to phorbol ester,"AP1-1 | mediates response to phorbol ester | FOS like 2, AP-1 trancription factor subunit"
chr1,152908415,152908436,"protein_bind: JunB proto-oncogene, AP-1 transcription factor subunit",0,+,152908415,152908436,"192,0,0",protein_binding_site,AP1-1,107880064|GeneID:107880064,"7759510|PMID:7759510,15037572|PMID:15037572,20006635|PMID:20006635","EXISTENCE:protein binding evidence [ECO:0000024][PMID:7759510, PMID:15037572, PMID:20006635]","mediates response to phorbol ester, arsenite","AP1-1 | mediates response to phorbol ester, arsenite | JunB proto-oncogene, AP-1 transcription factor subunit"
chr1,152908416,152908438,"protein_bind: Fos proto-oncogene, AP-1 trancription factor subunit",0,+,152908416,152908438,"192,0,0",protein_binding_site,AP1-1,107880064|GeneID:107880064,9506439|PMID:9506439,EXISTENCE:protein binding evidence [ECO:0000024][PMID:9506439],mediates response to protein kinase C,"AP1-1 | mediates response to protein kinase C | Fos proto-oncogene, AP-1 trancription factor subunit"
chr1,152908416,152908438,"protein_bind: Jun proto-oncogene, AP-1 transcription factor subunit",0,+,152908416,152908438,"192,0,0",protein_binding_site,AP1-1,107880064|GeneID:107880064,9506439|PMID:9506439,EXISTENCE:protein binding evidence [ECO:0000024][PMID:9506439],mediates response to protein kinase C,"AP1-1 | mediates response to protein kinase C | Jun proto-oncogene, AP-1 transcription factor subunit"
chr1,152908417,152908436,"protein_bind: FOS like 1, AP-1 trancription factor subunit",0,+,152908417,152908436,"192,0,0",protein_binding_site,AP1-1,107880064|GeneID:107880064,"7759510|PMID:7759510,11698415|PMID:11698415,15037572|PMID:15037572,20006635|PMID:20006635","EXISTENCE:protein binding evidence [ECO:0000024][PMID:7759510, PMID:11698415, PMID:15037572, PMID:20006635]","mediates response to phorbol ester, green tea polyphenol, arsenite","AP1-1 | mediates response to phorbol ester, green tea polyphenol, arsenite | FOS like 1, AP-1 trancription factor subunit"
chr1,152908417,152908436,"protein_bind: FosB proto-oncogene, AP-1 trancription factor subunit",0,+,152908417,152908436,"192,0,0",protein_binding_site,AP1-1,107880064|GeneID:107880064,15025563|PMID:15025563,EXISTENCE:protein binding evidence [ECO:0000024][PMID:15025563],,"AP1-1 | FosB proto-oncogene, AP-1 trancription factor subunit"
chr1,152908417,152908436,"protein_bind: JunD proto-oncogene, AP-1 transcription factor subunit",0,+,152908417,152908436,"192,0,0",protein_binding_site,AP1-1,107880064|GeneID:107880064,"7759510|PMID:7759510,11698415|PMID:11698415","EXISTENCE:protein binding evidence [ECO:0000024][PMID:7759510, PMID:11698415]",mediates response to phorbol ester and green tea polyphenol,"AP1-1 | mediates response to phorbol ester and green tea polyphenol | JunD proto-oncogene, AP-1 transcription factor subunit"
chr1,152908585,152909786,silencer,0,+,152908585,152909786,128128,silencer,+40 to +1240,"107880064|GeneID:107880064,3713|GeneID:3713","1487505|PMID:1487505,10816578|PMID:10816578","EXISTENCE:reporter gene assay evidence [ECO:0000049][PMID:1487505, PMID:10816578]",may downregulate expression in MCF-7 and keratinocytes on heterologous promoter and may regulate native promoter,+40 to +1240 | may downregulate expression in MCF-7 and keratinocytes on heterologous promoter and may regulate native promoter
chr1,155213011,155215463,non_allelic_homologous,0,+,155213011,155215463,"160,82,45",recombination_feature,"sub-region e', recombines with sub-region e within the GBA recombination region",106627982|GeneID:106627982,12587096|PMID:12587096,EXISTENCE:nucleotide sequencing assay evidence [ECO:0000219][PMID:12587096],,"sub-region e', recombines with sub-region e within the GBA recombination region"
chr1,155216649,155216665,non_allelic_homologous,0,+,155216649,155216665,"160,82,45",recombination_feature,"sub-region d', recombines with sub-region d within the GBA recombination region",106627982|GeneID:106627982,11042032|PMID:11042032,EXISTENCE:nucleotide sequencing assay evidence [ECO:0000219][PMID:11042032],,"sub-region d', recombines with sub-region d within the GBA recombination region"
chr1,155217477,155217578,non_allelic_homologous,0,+,155217477,155217578,"160,82,45",recombination_feature,"sub-region c', recombines with sub-region c within the GBA recombination region",106627982|GeneID:106627982,12587096|PMID:12587096,EXISTENCE:nucleotide sequencing assay evidence [ECO:0000219][PMID:12587096],,"sub-region c', recombines with sub-region c within the GBA recombination region"
chr1,155217882,155217908,non_allelic_homologous,0,+,155217882,155217908,"160,82,45",recombination_feature,"sub-region b', recombines with sub-region b within the GBA recombination region",106627982|GeneID:106627982,12587096|PMID:12587096,EXISTENCE:nucleotide sequencing assay evidence [ECO:0000219][PMID:12587096],,"sub-region b', recombines with sub-region b within the GBA recombination region"
chr1,155218147,155218165,non_allelic_homologous,0,+,155218147,155218165,"160,82,45",recombination_feature,"sub-region a', recombines with sub-region a within the GBA recombination region",106627982|GeneID:106627982,11112377|PMID:11112377,EXISTENCE:nucleotide sequencing assay evidence [ECO:0000219][PMID:11112377],,"sub-region a', recombines with sub-region a within the GBA recombination region"
chr1,155233638,155236144,non_allelic_homologous,0,+,155233638,155236144,"160,82,45",recombination_feature,"sub-region e, recombines with sub-region e' within the GBAP1 recombination region",106627981|GeneID:106627981,12587096|PMID:12587096,EXISTENCE:nucleotide sequencing assay evidence [ECO:0000219][PMID:12587096],,"sub-region e, recombines with sub-region e' within the GBAP1 recombination region"
chr1,155237606,155237941,non_allelic_homologous,0,+,155237606,155237941,"160,82,45",recombination_feature,"sub-region d, recombines with sub-region d' within the GBAP1 recombination region",106627981|GeneID:106627981,11042032|PMID:11042032,EXISTENCE:nucleotide sequencing assay evidence [ECO:0000219][PMID:11042032],,"sub-region d, recombines with sub-region d' within the GBAP1 recombination region"
chr1,155238754,155238855,non_allelic_homologous,0,+,155238754,155238855,"160,82,45",recombination_feature,"sub-region c, recombines with sub-region c' within the GBAP1 recombination region",106627981|GeneID:106627981,12587096|PMID:12587096,EXISTENCE:nucleotide sequencing assay evidence [ECO:0000219][PMID:12587096],,"sub-region c, recombines with sub-region c' within the GBAP1 recombination region"
chr1,155239804,155239830,non_allelic_homologous,0,+,155239804,155239830,"160,82,45",recombination_feature,"sub-region b, recombines with sub-region b' within the GBAP1 recombination region",106627981|GeneID:106627981,12587096|PMID:12587096,EXISTENCE:nucleotide sequencing assay evidence [ECO:0000219][PMID:12587096],,"sub-region b, recombines with sub-region b' within the GBAP1 recombination region"
chr1,155240074,155240092,non_allelic_homologous,0,+,155240074,155240092,"160,82,45",recombination_feature,"sub-region a, recombines with sub-region a' within the GBAP1 recombination region",106627981|GeneID:106627981,11112377|PMID:11112377,EXISTENCE:nucleotide sequencing assay evidence [ECO:0000219][PMID:11112377],,"sub-region a, recombines with sub-region a' within the GBAP1 recombination region"
chr1,156102511,156107058,enhancer,0,+,156102511,156107058,128128,enhancer,VISTA enhancer hs2129,"110121262|GeneID:110121262,4000|GeneID:4000",17130149|PMID:17130149,EXISTENCE:transgenic organism evidence [ECO:0001131][PMID:17130149],enhancer in: heart[14/17],VISTA enhancer hs2129 | enhancer in: heart[14/17]
chr1,156240843,156242193,promoter,0,+,156240843,156242193,128128,promoter,-1339 to +10 promoter; BamHI/PvuII fragment,"110013312|GeneID:110013312,100527963|GeneID:100527963",2786632|PMID:2786632,EXISTENCE:reporter gene assay evidence [ECO:0000049][PMID:2786632],vitamin D-responsive promoter,-1339 to +10 promoter; BamHI/PvuII fragment | vitamin D-responsive promoter
chr1,156241547,156241577,transcriptional_cis_regulatory_region,0,+,156241547,156241577,128128,region,OSCARE-1; -634 to -605,"110013312|GeneID:110013312,100527963|GeneID:100527963",7598807|PMID:7598807,EXISTENCE:reporter gene assay evidence [ECO:0000049][PMID:7598807],contributes to basal promoter activity,OSCARE-1; -634 to -605 | contributes to basal promoter activity
chr1,156241615,156241776,enhancer,0,+,156241615,156241776,128128,enhancer,-568 to -407; BspEI/PvuII fragment,"110013312|GeneID:110013312,100527963|GeneID:100527963",2786632|PMID:2786632,EXISTENCE:reporter gene assay evidence [ECO:0000049][PMID:2786632],vitamin D-inducible enhancer,-568 to -407; BspEI/PvuII fragment | vitamin D-inducible enhancer
chr1,156241644,156241679,protein_bind: nuclear factor kappa B subunit 1,0,+,156241644,156241679,"192,0,0",protein_binding_site,TNFRE (tumor necrosis factor-responsive element),"110013312|GeneID:110013312,100527963|GeneID:100527963",8388544|PMID:8388544,EXISTENCE:protein binding evidence [ECO:0000024][PMID:8388544],mediates negative regulation by tumor necrosis factor,TNFRE (tumor necrosis factor-responsive element) | mediates negative regulation by tumor necrosis factor | nuclear factor kappa B subunit 1
chr1,156241671,156241701,"protein_bind: vitamin D (1,25- dihydroxyvitamin D3) receptor",0,+,156241671,156241701,"192,0,0",protein_binding_site,VDRE (vitamin D response element),"110013312|GeneID:110013312,100527963|GeneID:100527963",2174889|PMID:2174889,EXISTENCE:protein binding evidence [ECO:0000024][PMID:2174889],stimulates promoter activity; methylation-sensitive,"VDRE (vitamin D response element) | stimulates promoter activity; methylation-sensitive | vitamin D (1,25- dihydroxyvitamin D3) receptor"
chr1,156241672,156241691,"protein_bind: JunD and FOS like 2 proto-oncogenes, AP-1 transcription factor subunits",0,+,156241672,156241691,"192,0,0",protein_binding_site,AP-1/VDRE,"110013312|GeneID:110013312,100527963|GeneID:100527963",11684680|PMID:11684680,EXISTENCE:protein binding evidence [ECO:0000024][PMID:11684680],,"AP-1/VDRE | JunD and FOS like 2 proto-oncogenes, AP-1 transcription factor subunits"
chr1,156241673,156241695,"protein_bind: Jun and Fos proto-oncogenes, AP-1 transcription factor subunits",0,+,156241673,156241695,"192,0,0",protein_binding_site,HRE (hormone response element),"110013312|GeneID:110013312,100527963|GeneID:100527963",2159384|PMID:2159384,EXISTENCE:protein binding evidence [ECO:0000024][PMID:2159384],negative regulation of promoter activity,"HRE (hormone response element) | negative regulation of promoter activity | Jun and Fos proto-oncogenes, AP-1 transcription factor subunits"
chr1,156241673,156241695,protein_bind: retinoic acid receptor alpha,0,+,156241673,156241695,"192,0,0",protein_binding_site,HRE (hormone response element),"110013312|GeneID:110013312,100527963|GeneID:100527963",2159384|PMID:2159384,EXISTENCE:protein binding evidence [ECO:0000024][PMID:2159384],positive regulation of promoter activity,HRE (hormone response element) | positive regulation of promoter activity | retinoic acid receptor alpha
chr1,156241674,156241695,response_element,0,+,156241674,156241695,128128,regulatory_region,VDRE (vitamin D response element); -509 to -489; also corresponds to HRE,"110013312|GeneID:110013312,100527963|GeneID:100527963","2159384|PMID:2159384,2588000|PMID:2588000,2786632|PMID:2786632","EXISTENCE:reporter gene assay evidence [ECO:0000049][PMID:2786632, PMID:2159384, PMID:2588000]","confers responsiveness to vitamin D, vitamin A, and AP-1 family factors when multimerized","VDRE (vitamin D response element); -509 to -489; also corresponds to HRE | confers responsiveness to vitamin D, vitamin A, and AP-1 family factors when multimerized"
chr1,156241958,156242021,"protein_bind: Jun and Fos proto-oncogenes, AP-1 transcription factor subunits",0,+,156241958,156242021,"192,0,0",protein_binding_site,OSCARE-2; -226 to -163,"110013312|GeneID:110013312,100527963|GeneID:100527963",8707885|PMID:8707885,EXISTENCE:protein binding evidence [ECO:0000024][PMID:8707885],,"OSCARE-2; -226 to -163 | Jun and Fos proto-oncogenes, AP-1 transcription factor subunits"
chr1,156241960,156241966,protein_bind: transcriptional repressor GATA binding 1,0,+,156241960,156241966,"192,0,0",protein_binding_site,GATA site,"110013312|GeneID:110013312,100527963|GeneID:100527963",19759027|PMID:19759027,EXISTENCE:protein binding evidence [ECO:0000024][PMID:19759027],,GATA site | transcriptional repressor GATA binding 1
chr1,156241985,156242015,transcriptional_cis_regulatory_region,0,+,156241985,156242015,128128,region,ORE-1,"110013312|GeneID:110013312,632|GeneID:632",7593272|PMID:7593272,EXISTENCE:reporter gene assay evidence [ECO:0000049][PMID:7593272],contributes to repression of promoter activity in NIH3T3 cells,ORE-1 | contributes to repression of promoter activity in NIH3T3 cells
chr1,156241990,156242193,promoter,0,+,156241990,156242193,128128,promoter,-193 to +10; ApaI/PvuII fragment,"110013312|GeneID:110013312,632|GeneID:632",2786632|PMID:2786632,EXISTENCE:reporter gene assay evidence [ECO:0000049][PMID:2786632],,-193 to +10; ApaI/PvuII fragment
chr1,156242013,156242032,protein_bind: runt related transcription factor 2,0,+,156242013,156242032,"192,0,0",protein_binding_site,OSE2,"110013312|GeneID:110013312,632|GeneID:632",11684680|PMID:11684680,EXISTENCE:protein binding evidence [ECO:0000024][PMID:11684680],positive regulation of promoter activity,OSE2 | positive regulation of promoter activity | runt related transcription factor 2
chr1,156242115,156242144,"protein_bind: Sp1, Sp2, Sp3 transcription factors",0,+,156242115,156242144,"192,0,0",protein_binding_site,OSE1,"110013312|GeneID:110013312,632|GeneID:632",11684680|PMID:11684680,EXISTENCE:protein binding evidence [ECO:0000024][PMID:11684680],positive regulation of promoter activity,"OSE1 | positive regulation of promoter activity | Sp1, Sp2, Sp3 transcription factors"
chr1,156242144,156242177,protein_bind: TATA-box binding protein,0,+,156242144,156242177,"192,0,0",protein_binding_site,GRE; -41 to -9,"110013312|GeneID:110013312,632|GeneID:632",9303434|PMID:9303434,EXISTENCE:protein binding evidence [ECO:0000024][PMID:9303434],,GRE; -41 to -9 | TATA-box binding protein
chr1,156242150,156242172,protein_bind: nuclear receptor subfamily 3 group C member 1,0,+,156242150,156242172,"192,0,0",protein_binding_site,GR binding site,"110013312|GeneID:110013312,632|GeneID:632",2038339|PMID:2038339,EXISTENCE:protein binding evidence [ECO:0000024][PMID:2038339],negative regulation of promoter activity; competes for binding with TATA-box binding protein,GR binding site | negative regulation of promoter activity; competes for binding with TATA-box binding protein | nuclear receptor subfamily 3 group C member 1
chr1,156242155,156242161,TATA_box,0,+,156242155,156242161,128128,TATA_box,,"110013312|GeneID:110013312,632|GeneID:632",2588000|PMID:2588000,COORDINATES:motif similarity evidence [ECO:0000028][PMID:2588000],,TATA_box
chr1,156242259,156242266,transcriptional_cis_regulatory_region,0,+,156242259,156242266,128128,region,OSE (osteocalcin silencer element); +29 to +35,"110013312|GeneID:110013312,632|GeneID:632",8559666|PMID:8559666,EXISTENCE:site-directed mutagenesis evidence [ECO:0005528][PMID:8559666],negative regulation of transcription,OSE (osteocalcin silencer element); +29 to +35 | negative regulation of transcription
chr1,156660456,156665492,enhancer,0,+,156660456,156665492,128128,enhancer,VISTA enhancer hs1891,110121221|GeneID:110121221,17130149|PMID:17130149,EXISTENCE:transgenic organism evidence [ECO:0001131][PMID:17130149],enhancer in: somite[7/7] | midbrain (mesencephalon)[6/7] | limb[7/7] | branchial arch[7/7] | eye[7/7] | heart[7/7] | ear[7/7] | blood vessels[6/7],VISTA enhancer hs1891 | enhancer in: somite[7/7] | midbrain (mesencephalon)[6/7] | limb[7/7] | branchial arch[7/7] | eye[7/7] | heart[7/7] | ear[7/7] | blood vessels[6/7]
