#chrom,chromStart,chromEnd,name,score,strand,thickStart,thickEnd,reserved,soTerm,note,geneIds,pubMedIds,experiment,function,_mouseOver
chr1,163085281,163085975,enhancer,0,+,163085281,163085975,128128,enhancer,amplified fragment containing the chr1:163055304-163055539 (GRCh37) region with regulatory potential,108281190|GeneID:108281190,24670763|PMID:24670763,EXISTENCE:reporter gene assay evidence [ECO:0000049][PMID:24670763],nontranscribed enhancer in HeLa cells,amplified fragment containing the chr1:163055304-163055539 (GRCh37) region with regulatory potential | nontranscribed enhancer in HeLa cells
chr1,163085513,163085749,epigenetically_modified_region,0,+,163085513,163085749,128128,region,co-occurring H3K27ac and H3K4me1 histone modifications and no CAGE data in HeLa cells,108281190|GeneID:108281190,22955616|PMID:22955616,EXISTENCE:chromatin immunoprecipitation-seq evidence [ECO:0000229][PMID:22955616],,co-occurring H3K27ac and H3K4me1 histone modifications and no CAGE data in HeLa cells
chr1,163472150,163473052,enhancer,0,+,163472150,163473052,128128,enhancer,VISTA enhancer hs762,110120762|GeneID:110120762,17130149|PMID:17130149,EXISTENCE:transgenic organism evidence [ECO:0001131][PMID:17130149],enhancer in: hindbrain (rhombencephalon)[5/7] | midbrain (mesencephalon)[5/7],VISTA enhancer hs762 | enhancer in: hindbrain (rhombencephalon)[5/7] | midbrain (mesencephalon)[5/7]
chr1,163538174,163539349,enhancer,0,+,163538174,163539349,128128,enhancer,VISTA enhancer hs1185,110121019|GeneID:110121019,17130149|PMID:17130149,EXISTENCE:transgenic organism evidence [ECO:0001131][PMID:17130149],enhancer in: limb[4/6],VISTA enhancer hs1185 | enhancer in: limb[4/6]
chr1,164634903,164636237,enhancer,0,+,164634903,164636237,128128,enhancer,VISTA enhancer hs1202,"110121025|GeneID:110121025,5087|GeneID:5087",17130149|PMID:17130149,EXISTENCE:transgenic organism evidence [ECO:0001131][PMID:17130149],enhancer in: hindbrain (rhombencephalon)[6/6] | forebrain[4/6],VISTA enhancer hs1202 | enhancer in: hindbrain (rhombencephalon)[6/6] | forebrain[4/6]
chr1,164650800,164651927,enhancer,0,+,164650800,164651927,128128,enhancer,VISTA enhancer hs1235,"110121037|GeneID:110121037,5087|GeneID:5087",17130149|PMID:17130149,EXISTENCE:transgenic organism evidence [ECO:0001131][PMID:17130149],enhancer in: hindbrain (rhombencephalon)[6/8],VISTA enhancer hs1235 | enhancer in: hindbrain (rhombencephalon)[6/8]
chr1,164699354,164700586,enhancer,0,+,164699354,164700586,128128,enhancer,VISTA enhancer hs1144,"110121004|GeneID:110121004,5087|GeneID:5087",17130149|PMID:17130149,EXISTENCE:transgenic organism evidence [ECO:0001131][PMID:17130149],enhancer in: heart[5/12],VISTA enhancer hs1144 | enhancer in: heart[5/12]
chr1,164748260,164748780,enhancer,0,+,164748260,164748780,128128,enhancer,amplified fragment containing the chr1:164717528-164717907 (GRCh37) CAGE region,"108251792|GeneID:108251792,5087|GeneID:5087",24670763|PMID:24670763,EXISTENCE:reporter gene assay evidence [ECO:0000049][PMID:24670763],high expression transcribed enhancer in HeLa and HepG2 cells,amplified fragment containing the chr1:164717528-164717907 (GRCh37) CAGE region | high expression transcribed enhancer in HeLa and HepG2 cells
chr1,164748290,164748670,CAGE_cluster,0,+,164748290,164748670,"192,0,192",sequence_feature,CAGE cluster; bidirectional CAGE region,"108251792|GeneID:108251792,5087|GeneID:5087",24670763|PMID:24670763,EXISTENCE:cap analysis of gene expression evidence [ECO:0000309][PMID:24670763],,CAGE cluster; bidirectional CAGE region
chr1,164836269,164837557,enhancer,0,+,164836269,164837557,128128,enhancer,VISTA enhancer hs1191,"110121021|GeneID:110121021,5087|GeneID:5087",17130149|PMID:17130149,EXISTENCE:transgenic organism evidence [ECO:0001131][PMID:17130149],enhancer in: forebrain[4/7] | facial mesenchyme[3/7],VISTA enhancer hs1191 | enhancer in: forebrain[4/7] | facial mesenchyme[3/7]
chr1,167327716,167329809,enhancer,0,+,167327716,167329809,128128,enhancer,VISTA enhancer hs1331,"110121063|GeneID:110121063,5451|GeneID:5451",17130149|PMID:17130149,EXISTENCE:transgenic organism evidence [ECO:0001131][PMID:17130149],enhancer in: neural tube[4/7] | hindbrain (rhombencephalon)[4/7] | midbrain (mesencephalon)[5/7] | forebrain[7/7],VISTA enhancer hs1331 | enhancer in: neural tube[4/7] | hindbrain (rhombencephalon)[4/7] | midbrain (mesencephalon)[5/7] | forebrain[7/7]
chr1,169941254,169943938,enhancer,0,+,169941254,169943938,128128,enhancer,VISTA enhancer hs1442,110121105|GeneID:110121105,17130149|PMID:17130149,EXISTENCE:transgenic organism evidence [ECO:0001131][PMID:17130149],enhancer in: limb[10/11] | genital tubercle[9/11],VISTA enhancer hs1442 | enhancer in: limb[10/11] | genital tubercle[9/11]
chr1,181151912,181154518,enhancer,0,+,181151912,181154518,128128,enhancer,VISTA enhancer hs1862,110121215|GeneID:110121215,17130149|PMID:17130149,EXISTENCE:transgenic organism evidence [ECO:0001131][PMID:17130149],enhancer in: heart[6/6],VISTA enhancer hs1862 | enhancer in: heart[6/6]
chr1,183611756,183612264,enhancer,0,+,183611756,183612264,128128,enhancer,amplified fragment containing the chr1:183581059-183581217 (GRCh37) region with regulatory potential,108318669|GeneID:108318669,24670763|PMID:24670763,EXISTENCE:reporter gene assay evidence [ECO:0000049][PMID:24670763],nontranscribed enhancer in HeLa cells,amplified fragment containing the chr1:183581059-183581217 (GRCh37) region with regulatory potential | nontranscribed enhancer in HeLa cells
chr1,183611923,183612082,epigenetically_modified_region,0,+,183611923,183612082,128128,region,co-occurring H3K27ac and H3K4me1 histone modifications and no CAGE data in HeLa cells,108318669|GeneID:108318669,22955616|PMID:22955616,EXISTENCE:chromatin immunoprecipitation-seq evidence [ECO:0000229][PMID:22955616],,co-occurring H3K27ac and H3K4me1 histone modifications and no CAGE data in HeLa cells
chr1,188668051,188668618,DNase_I_hypersensitive_site,0,+,188668051,188668618,128128,region,region containing the chr1.11400 DHS; the nucleotide coordinates are approximate for this feature,108281185|GeneID:108281185,22955617|PMID:22955617,EXISTENCE:in vivo cleavage assay evidence [ECO:0001075][PMID:22955617],,region containing the chr1.11400 DHS; the nucleotide coordinates are approximate for this feature
chr1,188668051,188668618,enhancer,0,+,188668051,188668618,128128,enhancer,amplified fragment containing the chr1.11400 DHS,108281185|GeneID:108281185,24670763|PMID:24670763,EXISTENCE:reporter gene assay evidence [ECO:0000049][PMID:24670763],nontranscribed enhancer in HeLa cells,amplified fragment containing the chr1.11400 DHS | nontranscribed enhancer in HeLa cells
chr1,198294431,198296612,enhancer,0,+,198294431,198296612,128128,enhancer,VISTA enhancer hs1322,"110121056|GeneID:110121056,140609|GeneID:140609",17130149|PMID:17130149,EXISTENCE:transgenic organism evidence [ECO:0001131][PMID:17130149],enhancer in: hindbrain (rhombencephalon)[9/9] | midbrain (mesencephalon)[6/9] | dorsal root ganglion[6/9] | forebrain[5/9] | branchial arch[5/9],VISTA enhancer hs1322 | enhancer in: hindbrain (rhombencephalon)[9/9] | midbrain (mesencephalon)[6/9] | dorsal root ganglion[6/9] | forebrain[5/9] | branchial arch[5/9]
chr1,198681669,198682240,enhancer,0,+,198681669,198682240,128128,enhancer,amplified fragment containing most of the chr1:198650930-198651643 (GRCh37) CAGE region,"108281163|GeneID:108281163,5788|GeneID:5788",24670763|PMID:24670763,EXISTENCE:reporter gene assay evidence [ECO:0000049][PMID:24670763],mid-level expression transcribed enhancer in HeLa cells,amplified fragment containing most of the chr1:198650930-198651643 (GRCh37) CAGE region | mid-level expression transcribed enhancer in HeLa cells
chr1,198681800,198682514,CAGE_cluster,0,+,198681800,198682514,"192,0,192",sequence_feature,CAGE cluster; bidirectional CAGE region,"108281163|GeneID:108281163,5788|GeneID:5788",24670763|PMID:24670763,EXISTENCE:cap analysis of gene expression evidence [ECO:0000309][PMID:24670763],,CAGE cluster; bidirectional CAGE region
chr1,200072515,200073089,enhancer,0,+,200072515,200073089,128128,enhancer,heart enhancer 1,"107988045|GeneID:107988045,2494|GeneID:2494",20075146|PMID:20075146,EXISTENCE:transgenic organism evidence [ECO:0001131][PMID:20075146],enhancer in heart,heart enhancer 1 | enhancer in heart
chr1,204162165,204166193,silencer,0,+,204162165,204166193,128128,silencer,intron A,107548112|GeneID:107548112,"8760248|PMID:8760248,9166895|PMID:9166895,10419062|PMID:10419062","EXISTENCE:reporter gene assay evidence [ECO:0000049][PMID:8760248, PMID:9166895, PMID:10419062]",negative regulator of gene expression,intron A | negative regulator of gene expression
chr1,204162633,204162713,protein_bind: CCCTC-binding factor,0,+,204162633,204162713,"192,0,0",protein_binding_site,site 1,107548112|GeneID:107548112,18632798|PMID:18632798,EXISTENCE:protein binding evidence [ECO:0000024][PMID:18632798],,site 1 | CCCTC-binding factor
chr1,204166321,204178479,promoter,0,+,204166321,204178479,128128,promoter,12 kb region for complete renin regulatory region; -12166 to +16,107548112|GeneID:107548112,12163396|PMID:12163396,EXISTENCE:transgenic organism evidence [ECO:0001131][PMID:12163396],promotes expression in kidney and renin-expressing cells,12 kb region for complete renin regulatory region; -12166 to +16 | promotes expression in kidney and renin-expressing cells
chr1,204166333,204166485,promoter,0,+,204166333,204166485,128128,promoter,-148 to +4 promoter,107548112|GeneID:107548112,8420924|PMID:8420924,EXISTENCE:reporter gene assay evidence [ECO:0000049][PMID:8420924],"active promoter in multiple renin-expressing cell lines; drives expression of transgene in juxtaglomerular cells of kidney, lung, and adipose tissue","-148 to +4 promoter | active promoter in multiple renin-expressing cell lines; drives expression of transgene in juxtaglomerular cells of kidney, lung, and adipose tissue"
chr1,204166335,204166371,"protein_bind: ETS proto-oncogene 1, transcription factor",0,+,204166335,204166371,"192,0,0",protein_binding_site,Ets-REN; includes footprint A,107548112|GeneID:107548112,"8914017|PMID:8914017,15368359|PMID:15368359","EXISTENCE:protein binding evidence [ECO:0000024][PMID:8914017, PMID:15368359]",,"Ets-REN; includes footprint A | ETS proto-oncogene 1, transcription factor"
chr1,204166396,204166419,transcriptional_cis_regulatory_region,0,+,204166396,204166419,128128,region,"RP-2, also called PPE (proximal promoter element); -78 to -60",107548112|GeneID:107548112,"8420924|PMID:8420924,8645191|PMID:8645191","EXISTENCE:reporter gene assay evidence [ECO:0000049][PMID:8420924, PMID:8645191]",mediates activation by POU class 1 homeobox 1,"RP-2, also called PPE (proximal promoter element); -78 to -60 | mediates activation by POU class 1 homeobox 1"
chr1,204166403,204166711,transcriptional_cis_regulatory_region,0,+,204166403,204166711,128128,region,-367 to -67,107548112|GeneID:107548112,8156625|PMID:8156625,EXISTENCE:reporter gene assay evidence [ECO:0000049][PMID:8156625],contain multiple negative regulators of expression in chorionic cells,-367 to -67 | contain multiple negative regulators of expression in chorionic cells
chr1,204166444,204166478,protein_bind: nuclear receptor subfamily 1 group H member 3,0,+,204166444,204166478,"192,0,0",protein_binding_site,huREN/CNRE,107548112|GeneID:107548112,15353176|PMID:15353176,EXISTENCE:protein binding evidence [ECO:0000024][PMID:15353176],mediates response to cyclic AMP,huREN/CNRE | mediates response to cyclic AMP | nuclear receptor subfamily 1 group H member 3
chr1,204166472,204166486,protein_bind: peroxisome proliferator activated receptor gamma,0,+,204166472,204166486,"192,0,0",protein_binding_site,Pal3,107548112|GeneID:107548112,18483152|PMID:18483152,EXISTENCE:protein binding evidence [ECO:0000024][PMID:18483152],promotes gene expression,Pal3 | promotes gene expression | peroxisome proliferator activated receptor gamma
chr1,204166472,204166486,protein_bind: retinoid X receptor alpha,0,+,204166472,204166486,"192,0,0",protein_binding_site,Pal3,107548112|GeneID:107548112,18483152|PMID:18483152,EXISTENCE:protein binding evidence [ECO:0000024][PMID:18483152],,Pal3 | retinoid X receptor alpha
chr1,204166485,204166920,promoter,0,+,204166485,204166920,128128,promoter,-583 to -149; contains positive and negative regulatory elements,107548112|GeneID:107548112,2540188|PMID:2540188,EXISTENCE:reporter gene assay evidence [ECO:0000049][PMID:2540188],strong promoter in JEG-3 cells,-583 to -149; contains positive and negative regulatory elements | strong promoter in JEG-3 cells
chr1,204166535,204166571,protein_bind: activating transcription factor 1,0,+,204166535,204166571,"192,0,0",protein_binding_site,CRE_REN or hRENCRE or proxCRE; contains footprint D,107548112|GeneID:107548112,8999953|PMID:8999953,EXISTENCE:protein binding evidence [ECO:0000024][PMID:8999953],,CRE_REN or hRENCRE or proxCRE; contains footprint D | activating transcription factor 1
chr1,204166535,204166571,protein_bind: cAMP responsive element binding protein 1,0,+,204166535,204166571,"192,0,0",protein_binding_site,CRE_REN or hRENCRE or proxCRE; contains footprint D,107548112|GeneID:107548112,"8645191|PMID:8645191,8999953|PMID:8999953","EXISTENCE:protein binding evidence [ECO:0000024][PMID:8645191, PMID:8999953]",mediates response to cyclic AMP,CRE_REN or hRENCRE or proxCRE; contains footprint D | mediates response to cyclic AMP | cAMP responsive element binding protein 1
chr1,204166565,204166601,"protein_bind: nuclear receptor subfamily 2, group F, member 2",0,+,204166565,204166601,"192,0,0",protein_binding_site,ARP-1-REN or COUP-TFII-REN; includes footpring E,107548112|GeneID:107548112,"8914017|PMID:8914017,15368359|PMID:15368359,17455195|PMID:17455195","EXISTENCE:protein binding evidence [ECO:0000024][PMID:8914017, PMID:15368359, PMID:17455195]",,"ARP-1-REN or COUP-TFII-REN; includes footpring E | nuclear receptor subfamily 2, group F, member 2"
chr1,204166580,204166596,transcriptional_cis_regulatory_region,0,+,204166580,204166596,128128,region,-259 to -245; direct repeat (DR),107548112|GeneID:107548112,17455195|PMID:17455195,EXISTENCE:reporter gene assay evidence [ECO:0000049][PMID:17455195],negative regulation of transcription,-259 to -245; direct repeat (DR) | negative regulation of transcription
chr1,204167382,204167403,response_element,0,+,204167382,204167403,128128,regulatory_region,THRE (thyroid hormone response element); -1066 to -1046,107548112|GeneID:107548112,11208763|PMID:11208763,EXISTENCE:reporter gene assay evidence [ECO:0000049][PMID:11208763],mediates response to thyroid hormone,THRE (thyroid hormone response element); -1066 to -1046 | mediates response to thyroid hormone
chr1,204168089,204168144,response_element,0,+,204168089,204168144,128128,regulatory_region,nCARE (negative calcium response element),107548112|GeneID:107548112,12569263|PMID:12569263,EXISTENCE:reporter gene assay evidence [ECO:0000049][PMID:12569263],mediates negative regulation by calcium,nCARE (negative calcium response element) | mediates negative regulation by calcium
chr1,204168107,204168131,protein_bind: apurinic/apyrimidinic endodeoxyribonuclease 1,0,+,204168107,204168131,"192,0,0",protein_binding_site,nCARE,107548112|GeneID:107548112,12569263|PMID:12569263,EXISTENCE:protein binding evidence [ECO:0000024][PMID:12569263],,nCARE | apurinic/apyrimidinic endodeoxyribonuclease 1
chr1,204169156,204170255,transcriptional_cis_regulatory_region,0,+,204169156,204170255,128128,region,NRR (negative regulatory region); -3916 to -2822,107548112|GeneID:107548112,9853270|PMID:9853270,EXISTENCE:reporter gene assay evidence [ECO:0000049][PMID:9853270],important for negative regulation by tumor necrosis factor alpha,NRR (negative regulatory region); -3916 to -2822 | important for negative regulation by tumor necrosis factor alpha
chr1,204171622,204172214,enhancer,0,+,204171622,204172214,128128,enhancer,-5870 to -5279; includes polymporphic C/T site (rs12750834); T variant has increased activity,107548112|GeneID:107548112,12473863|PMID:12473863,EXISTENCE:reporter gene assay evidence [ECO:0000049][PMID:12473863],,-5870 to -5279; includes polymporphic C/T site (rs12750834); T variant has increased activity
chr1,204171895,204172121,enhancer,0,+,204171895,204172121,128128,enhancer,CE (chorionic enhancer); -5777 to -5552,107548112|GeneID:107548112,9737995|PMID:9737995,EXISTENCE:reporter gene assay evidence [ECO:0000049][PMID:9737995],,CE (chorionic enhancer); -5777 to -5552
chr1,204171961,204172000,transcriptional_cis_regulatory_region,0,+,204171961,204172000,128128,region,footprint C,107548112|GeneID:107548112,9737995|PMID:9737995,EXISTENCE:reporter gene assay evidence [ECO:0000049][PMID:9737995],important for enhancer activity,footprint C | important for enhancer activity
chr1,204177346,204177565,conserved_region,0,+,204177346,204177565,"192,0,192",sequence_feature,conserved_region; HEMM; 77% identity to mouse,107548112|GeneID:107548112,9314837|PMID:9314837,EXISTENCE:sequence alignment evidence [ECO:0000200][PMID:9314837],,conserved_region; HEMM; 77% identity to mouse
chr1,204177351,204177371,response_element,0,+,204177351,204177371,128128,regulatory_region,HRE (hormone response element),107548112|GeneID:107548112,"17785633|PMID:17785633,18483152|PMID:18483152","EXISTENCE:reporter gene assay evidence [ECO:0000049][PMID:17785633, PMID:18483152]",may contribute to induction of expression by peroxisome proliferator activated receptor gamma,HRE (hormone response element) | may contribute to induction of expression by peroxisome proliferator activated receptor gamma
chr1,204177353,204177565,enhancer,0,+,204177353,204177565,128128,enhancer,h202E or KE (kidney enhancer),107548112|GeneID:107548112,16990260|PMID:16990260,EXISTENCE:knockout evidence [ECO:0001091][PMID:16990260],required for full transcript levels in transgenic model,h202E or KE (kidney enhancer) | required for full transcript levels in transgenic model
chr1,204177354,204177355,sequence_comparison,0,+,204177354,204177355,"192,0,192",sequence_feature,sequence_comparison; C in human genome results in decreased activity relative to T in mouse genome,107548112|GeneID:107548112,10488050|PMID:10488050,COORDINATES:sequence alignment evidence [ECO:0000200][PMID:10488050],,sequence_comparison; C in human genome results in decreased activity relative to T in mouse genome
chr1,204177387,204177395,response_element,0,+,204177387,204177395,128128,regulatory_region,enhCRE,107548112|GeneID:107548112,21424707|PMID:21424707,EXISTENCE:reporter gene assay evidence [ECO:0000049][PMID:21424707],mediates response to cyclic AMP and response to beta-adrenoreceptors and low salt diet,enhCRE | mediates response to cyclic AMP and response to beta-adrenoreceptors and low salt diet
chr1,204177458,204177479,protein_bind: Wilms tumor 1 -KTS isoform,0,+,204177458,204177479,"192,0,0",protein_binding_site,WT1ir,107548112|GeneID:107548112,18496514|PMID:18496514,EXISTENCE:protein binding evidence [ECO:0000024][PMID:18496514],negative regulation of enhancer activity,WT1ir | negative regulation of enhancer activity | Wilms tumor 1 -KTS isoform
chr1,204454829,204455807,enhancer,0,+,204454829,204455807,128128,enhancer,VISTA enhancer hs1368,110121081|GeneID:110121081,17130149|PMID:17130149,EXISTENCE:transgenic organism evidence [ECO:0001131][PMID:17130149],enhancer in: neural tube[6/10] | hindbrain (rhombencephalon)[6/10] | midbrain (mesencephalon)[6/10] | forebrain[6/10],VISTA enhancer hs1368 | enhancer in: neural tube[6/10] | hindbrain (rhombencephalon)[6/10] | midbrain (mesencephalon)[6/10] | forebrain[6/10]
chr1,209815704,209816479,enhancer,0,+,209815704,209816479,128128,enhancer,VISTA enhancer hs932,110120807|GeneID:110120807,17130149|PMID:17130149,EXISTENCE:transgenic organism evidence [ECO:0001131][PMID:17130149],enhancer in: limb[9/9] | branchial arch[9/9] | eye[6/9] | nose[7/9],VISTA enhancer hs932 | enhancer in: limb[9/9] | branchial arch[9/9] | eye[6/9] | nose[7/9]
chr1,212531403,212533951,enhancer,0,+,212531403,212533951,128128,enhancer,VISTA enhancer hs2089,110121257|GeneID:110121257,17130149|PMID:17130149,EXISTENCE:transgenic organism evidence [ECO:0001131][PMID:17130149],enhancer in: neural tube[4/10],VISTA enhancer hs2089 | enhancer in: neural tube[4/10]
chr1,213324768,213327791,enhancer,0,+,213324768,213327791,128128,enhancer,VISTA enhancer hs1324,"110121057|GeneID:110121057,26750|GeneID:26750",17130149|PMID:17130149,EXISTENCE:transgenic organism evidence [ECO:0001131][PMID:17130149],enhancer in: forebrain[6/6],VISTA enhancer hs1324 | enhancer in: forebrain[6/6]
chr1,213424620,213426181,enhancer,0,+,213424620,213426181,128128,enhancer,VISTA enhancer hs204,"110120610|GeneID:110120610,105372912|GeneID:105372912",17130149|PMID:17130149,EXISTENCE:transgenic organism evidence [ECO:0001131][PMID:17130149],enhancer in: forebrain[4/5],VISTA enhancer hs204 | enhancer in: forebrain[4/5]
chr1,214107251,214108737,enhancer,0,+,214107251,214108737,128128,enhancer,VISTA enhancer hs2357,110121306|GeneID:110121306,17130149|PMID:17130149,EXISTENCE:transgenic organism evidence [ECO:0001131][PMID:17130149],enhancer in: heart[8/11],VISTA enhancer hs2357 | enhancer in: heart[8/11]
chr1,218034089,218035156,enhancer,0,+,218034089,218035156,128128,enhancer,VISTA enhancer hs1257,110121042|GeneID:110121042,17130149|PMID:17130149,EXISTENCE:transgenic organism evidence [ECO:0001131][PMID:17130149],"enhancer in: hindbrain (rhombencephalon)[5/6] | trigeminal V (ganglion, cranial)[3/6]","VISTA enhancer hs1257 | enhancer in: hindbrain (rhombencephalon)[5/6] | trigeminal V (ganglion, cranial)[3/6]"
chr1,221973077,221973528,retrotransposon:LTR7,0,+,221973077,221973528,"0,0,192",mobile_genetic_element,direction; reverse,107325941|GeneID:107325941,20951845|PMID:20951845,,suggested as a possible recombination region in PMID:20951845,direction; reverse | suggested as a possible recombination region in PMID:20951845
chr1,221975431,221978506,retrotransposon:HERV-int,0,+,221975431,221978506,"0,0,192",mobile_genetic_element,direction; reverse,107325941|GeneID:107325941,,,,direction; reverse
chr1,221977063,221977223,non_allelic_homologous,0,+,221977063,221977223,"160,82,45",recombination_feature,"sub-region 1, recombines with sub-region 1' within the 1q41-q42 HERV-mediated distal recombination region",107325941|GeneID:107325941,25246103|PMID:25246103,EXISTENCE:nucleotide sequencing assay evidence [ECO:0000219][PMID:25246103],,"sub-region 1, recombines with sub-region 1' within the 1q41-q42 HERV-mediated distal recombination region"
chr1,221977225,221977278,non_allelic_homologous,0,+,221977225,221977278,"160,82,45",recombination_feature,"sub-region 2, recombines with sub-region 2' within the 1q41-q42 HERV-mediated distal recombination region",107325941|GeneID:107325941,25246103|PMID:25246103,EXISTENCE:nucleotide sequencing assay evidence [ECO:0000219][PMID:25246103],,"sub-region 2, recombines with sub-region 2' within the 1q41-q42 HERV-mediated distal recombination region"
chr1,223026735,223029699,retrotransposon:HERV-int,0,+,223026735,223029699,"0,0,192",mobile_genetic_element,direction; reverse,107325942|GeneID:107325942,,,,direction; reverse
chr1,223028361,223028521,non_allelic_homologous,0,+,223028361,223028521,"160,82,45",recombination_feature,"sub-region 1', recombines with sub-region 1 within the 1q41 HERV-mediated proximal recombination region",107325942|GeneID:107325942,25246103|PMID:25246103,EXISTENCE:nucleotide sequencing assay evidence [ECO:0000219][PMID:25246103],,"sub-region 1', recombines with sub-region 1 within the 1q41 HERV-mediated proximal recombination region"
chr1,223028523,223028576,non_allelic_homologous,0,+,223028523,223028576,"160,82,45",recombination_feature,"sub-region 2', recombines with sub-region 2 within the 1q41 HERV-mediated proximal recombination region",107325942|GeneID:107325942,25246103|PMID:25246103,EXISTENCE:nucleotide sequencing assay evidence [ECO:0000219][PMID:25246103],,"sub-region 2', recombines with sub-region 2 within the 1q41 HERV-mediated proximal recombination region"
chr1,223029701,223030156,retrotransposon:LTR7,0,+,223029701,223030156,"0,0,192",mobile_genetic_element,direction; reverse,107325942|GeneID:107325942,20951845|PMID:20951845,,suggested as a possible recombination region in PMID:20951845,direction; reverse | suggested as a possible recombination region in PMID:20951845
chr1,225766687,225768183,enhancer,0,+,225766687,225768183,128128,enhancer,VISTA enhancer hs2374,110121307|GeneID:110121307,17130149|PMID:17130149,EXISTENCE:transgenic organism evidence [ECO:0001131][PMID:17130149],enhancer in: branchial arch[4/5],VISTA enhancer hs2374 | enhancer in: branchial arch[4/5]
chr1,230750692,230754328,enhancer,0,+,230750692,230754328,128128,enhancer,VISTA enhancer hs2133,"110121263|GeneID:110121263,10753|GeneID:10753",17130149|PMID:17130149,EXISTENCE:transgenic organism evidence [ECO:0001131][PMID:17130149],enhancer in: heart[7/9] | other[6/9],VISTA enhancer hs2133 | enhancer in: heart[7/9] | other[6/9]
chr1,230848776,230852235,enhancer,0,+,230848776,230852235,128128,enhancer,VISTA enhancer hs1766,110121205|GeneID:110121205,17130149|PMID:17130149,EXISTENCE:transgenic organism evidence [ECO:0001131][PMID:17130149],enhancer in: dorsal root ganglion[7/12] | heart[12/12] | other[5/12],VISTA enhancer hs1766 | enhancer in: dorsal root ganglion[7/12] | heart[12/12] | other[5/12]
chr1,235971491,235974491,meiotic,0,+,235971491,235974491,"160,82,45",recombination_feature,crossovers mapped in sperm cells of males of European ancestry,107546747|GeneID:107546747,"15880103|PMID:15880103,16543360|PMID:16543360","EXISTENCE:DNA detection assay evidence [ECO:0005519][PMID:16543360, PMID:15880103]",,crossovers mapped in sperm cells of males of European ancestry
